item,reconstruction_or_headword,gloss,attestations,notes,external_comparanda,discussion
32,*h₁ék̂w-os,‘horse’,"HLuw. azu(wa), Lyc. esbe-; Toch. A yuk, Toch. B yakwe; OLat. equos; Gaul. epo-; ON jór, Goth. aíhwa-; Lith. ašvíenis ‘stallion’; Myc. i-qo, Gr. ἳππος; Arm. ēš; Ved. áśva-, Av. aspa-","Only the Slavic and Albanian branches miss this lexeme, and the horse can safely be ascribed to the earliest strata of PIE on internal evidence alone, despite Dolgopolsky’s attempt to discredit the inherent nature of the Anatolian forms (1993: 240). The root gives valuable insights to the intricacies of the velar series with the co-occurrence of the palatal *k̂- with the labial element *-w-: While satəm languages retain the independence of the labial element, basically [+pal] + [+lab], the centum languages fuse the phonemes into one, [+vel, +lab], and subsequently follow the rules governing the inherited labiovelars. The Greek forms remain, although clearly related, problematic, probably reflecting some kind of dialectal borrowing (Beekes 2008: 597f.), although Sihler suggests that at least the geminate may be a regular outcome of the inherited palatal-labial cluster (1995: 159f.). Internal derivation has been proposed from a root ‘swift’ attractive due to a common Graeco-Aryan collocation, ‘swift horses’, Gr. ὠκέες ἳπποι, Ved. áśvāḥ āśávaḥ, but the connection is formally difficult (Mallory & Adams 1997: 273), if not impossible (Beekes 2008: 597f.).","Kartvelian: e.g. Georgian ačua (children’s language) North Caucasian: *ɦɨ[n]čwĭ NW Caucasian: *č̣́ʷǝ > e.g. Abkhaz, Ubykh ačy (pl.) NE Caucasian: Avar, Lak ču, Akhvakh ičwa, Andi iča, etc. HU: Hur. eššǝ","The domestication of the horse represents a central pillar in Anthony‘s archaeological location of the PIE speakers on the Pontic Steppes (2007: 193-224), and intense and selective exploitation of the horse was widespread from around 4.500 BCE in the region from southern Ukraine through to Kazakhstan (Mallory & Adams 1997: 273ff.). It is thus noteworthy that Uralic did not borrow the PIE word. A common Proto-North Caucasian reconstruction has been posited, *ɦɨ[n]čwĭ, without convincing internal derivation, although the authors do not explicitly make the connection with PIE (NCED s.v. ‘horse’). Such a reconstruction, however, gives depth of time comparable to PIE, and invalidates Colarusso’s intricate and very idiosyncratic analysis of NW Caucasian and PIE with the aim of uniting the phyla in Proto-Pontic (2003: 41ff.). The Hurrian form is proposed as a loan from the satəm Mitanni-Aryan superstrate that brandished a particularly specialized equestrian vocabulary, especially owing to the assibilated geminate (Gamkrelidze & Ivanov 1995: 809). A similar origin has been suggested for Semitic, cf. Akkadian sisū and Ugarit ssw (despite confounding factors, cf. Militarev & Kogan 2005: 261ff.), Sumerian sí-sí (Sahala 2009: 10), some NE Caucasian languages (Dolgopolsky 1987: 19) as well as Abkhaz (Mallory & Adams 1997: 274), but these latter can just as well be explained from the bulk of Caucasian attestations treated below. According to Nikolayev & Starostin the sporadic Kartvelian forms can be ascribed to intra-Caucasian loan relations (NCED s.v. ‘horse’), and are thus considered secondary and beyond the scope of the present paper. The evidence presented by Dolgopolsky to substantiate the entry into Caucasian languages as an early Proto-Indo-Iranian loan rests solely with the palatal treatment of the internal velar in the Daghestanian dialects (1987: 19), but the argument is mute because palatals are reconstructed for PIE and there is no evidence to suggest that a proposed Proto-North Caucasian recipient language would not have treated them as such (§ 1.3.2.13). Indeed, if horses were a trademark of ancient PIE culture (predating the split of Anatolian) with concomitant mercantile prowess, and the PIE speakers interacted intensely with the North Caucasian linguistic area at an early date, it is very likely that the ‘horse’ represented a sufficiently valuable item to be transferred from PIE and subsequently thrive in the Caucasus (cf. Matasović 2012: 291). Tantalizing both in the initial laryngeal PNC *ɦ- to mirror PIE *h₁-and the internal sequence of palatalized velar plus labial glide, the only aberrant element in the North Caucasian stock is the nasal found in the Lezgian branch of NE Caucasian (reconstructed *ʡɨnšʷ [~ħ-], see NCED s.v. ‘horse’), but the circumstances are internally unclear. Alternative solutions, albeit less attractive, are chronological adjustments either (1) further back into prehistory and approaching Nostratic, or (2) later as a dialectal PIE loan, as suggested by Dolgopolsky (1987: 19)."
33,*h₁esh₂-r/n-,‘blood’,"Hit. ēsḫar-, CLuw. āsḫar-; Toch. A ysār, Toch. B yasar; Lat. aser, san-guīs; Latv. asins; Gr. ἒαρ; Ved. asnás (gen.).","An inherited heterokliticon (alternating *-r and *-n- in the casus rectus and obliquus, respectively) and thus grammatically considered part of the oldest strata of PIE, the antiquity of the item is, of course, corroborated by the distribution in all the ancient branches. Latin aser is known only from a gloss, but seems to be continued in the first element of the common form san-guis (the latter part is more obscure, cf. de Vaan 2008: 537f.). According to Mallory & Adams this term signifies the internal ‘living’ blood as opposed to external ‘dead’ *kréuh₂-, but this latter form is without reflexes in Anatolian and Tocharian (1997: 71).","Kartvelian: *zisxl̥- > e.g. Georgian sisxl-, Svan zisx Sumerian: úš- ‘b., gore’","Although formally hardly a direct match, the Kartvelian form may inform the phonology of PIE, where *h₁- should match with *z-, *e with *i, *s = *s, *h₂ with *x, and, ultimately, possibly *-r with *-l̥. But since Gamkrelidze & Ivanov connect Kartvelian by positing voiced reduplication of the root (1995: 774), the resemblance is rendered significantly less transparent. If viable, the item may then be compared semantically with ‘heart’ (item 69) as they find themselves within same technical field, and can thus conceivably have been transferred as technical or cultic epithets, cf. how Latin and Greek technical terms in medicine are used in modern English, e.g. (neo-Greek) rhinoplasty of the (inherited Germanic) nose. Weak circumstantial evidence supporting such a scenario may be found in the fact that it’s the only demonstrably inherited term in Kartvelian, whereas PIE may have distinguished two roots, but note that PIE, then, are more likely to have absorbed an additional term. The directionality proposed by Gamkrelidze & Ivanov (1995: 774) would leave Kartvelian without a native word for blood. Kaiser & Shevoroshkin reject the comparison on typological grounds since “the word for blood is among the first 25 [most stable] words” (1986: 369), but the history of the term in the IE languages attest differently with demonstrable loss in the Celtic, Germanic, and Slavic branches. The simple Sumerian comparandum brings little to the table and may be internally derived (cf. Sahala 2009: 13). This must, at best, be considered a tentative comparison pending further evidence."
34,*h₁ienh₂-ter-,‘female in-law’,Lat. ianitrīcēs; Lith. jentė; OCS je̜try; Hom.Gr. εἰνάτερες (pl.); Phryg. ἰανατερα; Arm. ner; Ved. yātar-.,No Anatolian nor Tocharian cognates.,NW Caucasian: Abzhywa a-jén 'female (of animals)' (Bomhard 2015: 55),"With only one dialectal attestation the NW Caucasian evidence is patently weak, even if the PIE item had demonstrable animal connotations (very common for female terms, cf. the notes on *ĝl̥h₃-(wos-) ‘sister-in-law’, item 19), which it does not."
35,*h₁ís(h₂)-u-,‘arrow’,"(?)Hit. isḫuwa(i)- ‘to throw, scatter, pour’; (?)Irish io-dhan ‘spear’, (?)Welsh eog ‘salmon’; Gr. ἰός; Ved. iṣu-, Av. išu-.","The Irish form, not traditionally connected with this group, has been proposed by Mann (1984: 434), but the accompanying Celtic comparanda definitely do not favor the proposition semantically. Mayrhofer ventures the Hittite connection (1988: 200), but faces opposition by Kloekhorst who prefers to consider the initial i- epenthetic and thus ascribes it to an earlier un-metathesized variant *sh₂u- to the verb traditionally reconstructed *suh₂-‘to rain’ (2008a: 396ff.). It seems, however, that both solutions could work semantically as well as formally (cf. Kimball 1999: 143). If the distribution is limited to Graeco-Aryan, it can hardly qualify as a candidate for the oldest strata of PIE, and may alternatively be an innovation to the verbal root *h₁eish₂- ‘set in motion’, as suggested by Mallory & Adams (1997: 78), notably only attested in Graeco-Aryan.",Semitic: *ḥiϑ w-,"If, indeed, a foreign element in (P)IE, as suggested by Dolgopolsky (1987: 15, 1989: 7), the regional distribution suggests later transfer, comparable to *pelek̂u- ‘axe’ (item 102) into Graeco-Aryan or late PIE. There seems to be a dearth of Afro-Asiatic cognates (cf. Orel & Stolbova 1995 and Militarev 2006 s.v. ‘arrow’), which questions its age in Semitic, too, and an unattested third source may be posited, but this seems unnecessarily complicated, and the item may well represent a borrowing from Semitic into late PIE."
36,*h₁ln̥bh-,‘lamb’,Goth. lamb ‘sheep’; (?)Gr. ἒλαφος ‘red deer’,"If rightly connected by Kroonen, this root has very limited and semantically difficult IE distribution, and for both branches necessarily different Ablaut grades (2013: 325f.). The traditional etymology for the Greek item departs from a possible Aeolic origin of the alternate form ἐλλός ‘fawn’ < *el-n-os, cf. Arm. eln ‘id.’, Lith. élnis ‘id.’, OCS elenĭ ‘id.’, Welsh elain ‘id.’ (e.g. Frisk 1960: 483ff.). Adams surely connects to these forms Toch. A yäl ‘gazelle’, B yal ‘id.’ and the rather elusive Hit. aliyan(a)- ‘(?)roebuck’ (2013:523), and further, more semantically tantalizing, Toch. B āl- ‘ram’ (2013:58). The labial obstruent in the main Greek lemma has then been compared to the identical ending of ἒρι-φος ‘youngling’ that is decisively derivational in Ved. vṛṣa-bhá- ‘bull’ from vr ́ṣan- ‘manly, powerful’ (Chantraine 1968: 333,372). This PIE suffix *-bʰé- may be relevant for Germanic regardless of the heritage. Lehmann hesitantly connects all of the above from a root *el- ‘brown’ (1986: 226), which may as well be fitted with the initial laryngeal *h₁-, but Germanic is formally difficult to include in this bulk. The Greek branch, along with its possible cognates, would surely help establish the root as of PIE origin, but the comparison is doubtful. Prudence dictates isolation for the root in Germanic.","NE Caucasian: *ɫVmbagV ‘sheep’ > Avar lémag, Akhvakh lãgi; Lezghian lap:ag","What appears to be a new comparison nonetheless suggests itself straightforwardly with almost perfect alignment of three identical radicals; moreover, the Avar gloss is a) ‘sheep’ b) ‘1yr old sheep’ (NCED s.v.), mirroring the Germanic semantics. According to Nikolayev & Starostin the NE Caucasian form is likely to have been borrowed (ibid.). It is possible that this lexeme at an early stage complimented the proper PIE *h₃ewi-‘sheep’ (item 58), either as a loan from an unidentified source but in common with NE Caucasian, or as an internal derivation; the semantic fate in Germanic and possible elsewhere in IE surely indicates a kind of specialization. The lexeme was transferred into Finnish lammas ‘sheep’ from a Germanic language spoken in the Baltic region, either Gutnish or Gothic (Kroonen 2013: 326), both of which developed (or retained) the less specialized meaning. The connection may thus be compared to PIE *h₂e(i)ĝ- ‘goat’ (item 40) as a lexical isogloss unique to NE Caucasian and western IE."
37,*(h₁)oi- ‘one’ (see § 5.1),,,,,
38,*(h₁)raudh-,‘copper’,"ON rauði ‘red iron ore’; OCS ruda ‘ore, metal’; Skr. lohá-, Farsi rōd","The distribution fails to cover the ancient branches, but nonetheless shows decent conformity across the board. The form in PIE appears to be an obvious derivation to its color, red < *h₁reudh-.","Sumerian: urudu (Dolgopolsky 1987: 23, Nichols 1997: 143)","The Sumerian connection would be stronger if Semitic or Caucasian languages showed similar reflexes, so although a connection cannot be ruled out entirely, perhaps most strongly of an original Wanderwort subjected to folk etymological remodeling, the presence of a true cognate here seems ill-fated (Mallory & Adams 1997: 379). *(h₁)reugh- ‘sour milk, butter’, see item 107 under *r-"
39,*h₁webh-,‘to weave’,"Hit. wep-; Toch. A wäp-, Toch. B wāp-; OHG weban; Alb. vej; Myc. e-we-pe-se-so- me-na (fut.part.), Gr. ὑφαίνω","Mallory & Adams suggests that this familiar item is an extension of the simpler root *h₂/3eu- ‘to weave’, which seems to continue its existence in the shadow of the derivation (1997: 572). The quality of the initial laryngeal, however, seems settled with the Mycenaean evidence as *h₁- (Kloekhorst 2008a: 1001f.). This root extension can obviously be traced back to earliest strata of PIE, i.e. before the departure of Anatolian.","Kartvelian: *γweb- > e.g. Georgian γob, Svan γweb 'log-trough; beehive' NW Caucasian: *x̆a- > e.g. Abkhaz -ħa-","The Svan material is somewhat obscure but may reasonably be included to establish a common Kartvelian etymology (cf. Klimov 1998: 225). If from PIE, the initial consonant in Kartvelian is tantalizing as might reflect an original PIE laryngeal, but the comparison is more attractive as an early loan from a developing Armenian language, cf. *woin- ‘wine’ (item 133), where the Kartvelian initial reflex is paralleled, but the root is unattested (Matasović 2012: 288), and the chronology for ‘wine’ remains disputed. A loan etymology has also been proposed for another item within the same semantic field, viz. from PIE *tek(?)-(s)- ‘to craft’ (item 122), also borrowed into Kartvelian. Although presumably fairly archaic, the semantic field does appear conducive for lexical borrowing of a specialized skill or trade. The evidence presented by Colarusso for NW Caucasian (2003: 55) is wholly unconvincing, especially in light of Nikolayev & Starostin’s reconstruction of a Proto-North Caucasian root, *-iqăr (NCED s.v. ‘weave’), that accounts for the forms while irrevocably severing all formal ties to PIE. *(h₁)wer- ‘water, rain’, see item 130 under *w-"
40,*h₂e(i)ĝ-,‘goat’ PIE (1) *h₂eiĝ-,"Alb. dhi; Gr. αἲξ; Arm. aic; (?)Ved. eḍa- ‘kind of sheep’, Av. īzaena- ‘leathern’","The Vedic requires analogy to fit the picture, but seems plausible (cf. Mayrhofer 1986: 264). Attestations only warrant reconstruction for late PIE. PIE (2) *h₂eĝ-","North Caucasian: *Hējʒ́u (cf. *ʡējʒ́wē of NCED s.v. ‘goat, she-goat’)","The variant forms within (P)IE do suggest a foreign source, which, indeed, may be found in North Caucasian, as suggested by S. Starostin (2009: 80 fn.8). This is certainly suggested by the phonological compositions that are close to being superimposable, especially on reconstruction (1) with the diphtongue. The second reconstruction may under this paradigm be explained as either stemming from folk-etymological analogy with the homophonous verbal root *h₂eĝ- ‘to lead’, or as the natural yet inconsequent treatment of a foreign sequence in (P)IE (cf. Matasović 2012: 290 fn.16). Further phonological confusion is encountered if PIE *h₂egw-no- ‘lamb’ (item 45) is considered a derivative to the present form."
41,*h₂ebh-,‘river’,"(?)Hit. ḫapa-, (?)Luw. ḫāpa/i-; Lat. amnis; OIr. aub.","Although the validity of the Anatolian forms is questioned by Mallory & Adams (1997: 486), rendering the extent of distribution geographically close Italo-Celtic, Kloekhorst confidently connects the ancient branch (2008a: 294f.) which establishes the item for early PIE. The distribution suggests that the item was lost in many central IE branches, possibly as a common innovation.","Egyptian: hpi ‘go, travel’","Suggested by Bomhard as evidence of genetic relationship (1981: 436), this comparandum suffers from semantic discontinuity, and does not reflect loan relations to or from PIE. No further Afro-Asiatic can safely be established, either."
42,*h₂ebVl-,‘apple’,"(?)Osc. Abella (toponym); OIr. ubull; ON epli; Lith. obuolỹs; OCS (j)ablŭko; (?)Thr. dinopula, synopula; (?)Pashaei wālī, (?)Kashmiri ambari-trel ‘small kind of a.’, (?)Pashto maṇá","The Thracian forms may well be connected as literal ‘dog-apple’, a perfect cognate of Lithuanian šun-obuolỹs (Markey 1988: 51), but there is no evidence for a PIE term (ibid. passim.). An Indo-Iranian strain may be included, but requires some irregular developments to fit with the European stock (Mallory & Adams 1997: 25), especially if the more erratic Iranian strain continuing *marnā- (Morgenstierne 1927: 45) is heeded. Here, like elsewhere, the reconstruction of *h₂e- rather than *a- is based on assumptions of PIE that was evidently resolved by the ultimate dispersal of the dialect continuum.",Uralic: Fenno-Volgaic *omɜrɜ or*omena,"Apples were only domesticated in the 1st millennium BC (Zohary 1990:39), and the item is a clear wanderwort and traces its entrance to a handful of IE languages long after the dissolution of PIE (Campbell 1990: 163f., cf. also S. Starostin 2009: 93f.)."
43,*h₂eĝ-,‘to lead’,"Toch. A ākeñc, Toch. B āśäṃ; Lat. agō; OIr. -aig; ON aka ‘convey’; Gr. ἂγω; Arm. acem; Ved. ájati, YAv. azaiti.","The lack of Anatolian cognates for an otherwise prolific root only safely establishes a reconstruction for early middle PIE. The reconstruction of this root is tied to the question whether PIE *a was a natural part of the phonological system or merely introduced and developed. Due to the clear cases of laryngeal coloring of *e to *a in the immediate vicinity of *h₂, there are few examples where a PIE *a need be posited. Depending on which hypothesis is preferred, and, more generally, what stage of PIE an item belongs to, this reconstruction may as well be *aĝ-. The root is generally assumed to be the derivational basis for *h₂eĝ-ros (item 44).","Uralic: FU *aja Semitic: *ḥak’-ak’- ‘command’ NW Caucasian: *x̂we- 'drive, push' HU: Hurrian and Urartian ag- ‘to bring, to lead’","This type of root more easily finds comparanda because of the short root form and basic meaning, cf. *dʰeh₁- ‘to put, place’ and *deh₃- ‘to give’ (items 11 and 8, respectively). Such is the case with the Hurro-Urartian material (suggested as connected by Fournet & Bomhard 2010: 107 and Gamkrelidze & Ivanov 1995: 779, respectively) where it is extremely difficult to substantiate that the sequence VG is not simply due to chance; semantically there is no problem. Additional phonological evidence hereto may thus be found in Nikolayev & Starostin’s reconstruction of a North Caucasian *-ărḳĔw ‘to drive, urge’ (NCED s.v.) that seems to have a more complex consonant cluster than PIE in addition to reconstructed a-vocalism which seldom favors very old strata of PIE. Where the North Caucasian evidence alone then appears too far removed to constitute a viable formal connection, with the added consequence of rendering Colarusso’s NW Caucasian comparison (2003: 56) obsolete, the IE material nowhere demands an aboriginal sequence *h₂e-, and, strictly tentatively, a source may thus be found in a simplified descendant of North Caucasian, possibly resembling Hurro-Urartian. The Uralic forms probably have been borrowed from Indo-Iranian due both to vocalism and consonantism (cf. Koivulehto 1994: 137f.), a connection that still stands scrutiny if a North Caucasian origin is accepted. More difficult seems the connection with Semitic that evidently brands a more complex morphological structure, so the comparison need be weighed against the intended genetic affinity theory (Bomhard 1981: 432, 2008: 647f.) which is beyond the scope of the present investigation."
44,*h₂eg̑-ro-s,‘field’,"Lat. ager; Goth. akrs; Myc. a-ko-ro, Gr. ἀγρός; Arm. art; Ved. ájra- ‘plain’.","Possibly a PIE, but, due to distribution, hardly ancient, derivation of the verbal root *h₂eg̑- ‘to lead, drive (cattle)’ (item 43), and thus semantically developed from ‘pasture’, which may be indicated by the semantics of the Vedic cognate (Mallory & Adams 1997: 200). The connection is questionable (cf. Sihler 1995:45), however, requiring a strange *-ro-derivation, and the association to PIE word stock may thus be ascribed to folk-etymological reinterpretation.","Semitic: *ḫagar ‘arable field’ > Ge’ez hagar, Aramaic haǧar ‘village’ (Dolgopolsky 1987: 23) Semitic (alternative): *ḥk’l > Arabic haql, Akk. eqlu, Aramaic ḥaglā (Bomhard 1981: 431) Sumerian: agar ‘irrigated territory, grainfield’ (Gamkrelidze & Ivanov 1995: 773) NE Caucasian: *ˁüć ć ürV ‘meadow, glade, clearing’ (S. Starostin 2009: 98)","An external source is necessarily challenged by the proposed internal PIE derivation of the item, but it is, of course, conceivable that a technical innovation that followed the spread of agriculture carried along with it a lexical item that was absorbed by the recipient linguistic community. Dolgopolsky suggests that the Sumerian term only relates to (P)IE through Semitic (1987: 23), while Diakonoff questions the connection altogether (1985: 134). Whereas Bomhard’s group may have Afro-Asiatic cognates, cf. Orel & Stolbova who posit East Chadic *kVl- ‘earth’, from a common *ḥaḳVl- ‘earth, field’ (1995: 271), *ḫagar appears to be isolated in a few Semitic forms and may well be connected with Sumerian (originally proposed by Schott 1936: 83) and the IE comparanda (cf. Tyloch 1975: ## 56 fn.5). The Caucasian connection appears comparatively weaker, both formally and semantically, although the latter may be offset by the meaning in Vedic. As with the verbal root *h₂eg̑- (item 43), the similarities can ultimately stem from chance resemblance, but may as well be a part of the extensive linguistic influx of agricultural terms in primarily western IE languages."
45,*h₂egw-no-,‘lamb’,Lat. agnus; OIr. úan; OEng. ēanian ‘to yean’; OCS agnę; Gr. ἀμνός,"Attestations reflect limited distribution, that nonetheless seems tightknit despite minor differences (Frisk 1969: 93f.). The item cannot be posited for the earlier stages of PIE, and appear to be a European regionalism.",Semitic: cigl- ‘young animal’ (Gamkrelidze & Ivanov 1995: 769),"Orel & Stolbova connect Semitic with cognates in Central Chadic, Cushitic, and Omotic to establish Afro-Asiatic *cigal ‘cow, calf’ (1995: 247), and note should be made of the semantics that are consistently bovine except for the generalization that incurred very sporadically in Ge’ez to ‘young animal’ and possibly also Akkadian agalu ‘donkey’. Gamkrelidze & Ivanov choose to weigh the more general meaning (ibid.) that more readily resonates with the (P)IE reconstruction despite considerable evidence pointing to the conclusion of higher specialization (cf. also Diakonoff1985: 129f.); the Semitic comparanda should consequently be rejected. Rather, the word may be connected with *h₂e(i)ĝ- ‘goat’ (item 40), which requires both semantic drift and an explanation of the formally incompatible velars, that may be ascribed to its putative foreign nature."
46,*h₂eis-,‘metal’,"Lat. aes; ME ore; Av. ayah-, Skr. áyas-","The internal semantic development in the individual branches that seems to corroborate a technological transition from general ‘metal’, or possibly ‘copper’, to more sophisticated stages of metallurgy, e.g. Skr. áyas- ‘iron’ (Mallory & Adams 2006: 241), is expected in light of the fact that copper is among the earliest metal known to have been used, probably along with gold (Gamkrelidze & Ivanov 1995: 773). The limited distribution makes a reconstruction to early PIE untenable.","NW Caucasian: *yəx̂a ‘iron, metal’","Colarusso’s connection to NW Caucasian (1997: 144) is, as always, hard to weigh given the intricacies of the language family crossed with the complexities and bias of the proposer. The lack of a North Caucasian root renders the form isolated, and must be considered an unlikely candidate, although difficult to disproof. A foreign origin for the (P)IE term would help explain the limited distribution."
47,*h₂elut-,‘beer’,(?)Lat. alūmen ‘alum’; ON ǫl; Lith. alùs; OCS olŭ; (?)Gr. ἀλύδ(ο)ιμον (Hes.) ‘sharp (of taste)’; Ossetic ælūton.,"The Latin and Greek connections are attractive and help focus the inherited meaning behind the derivation that likely occurred in a late PIE stratum. Mallory & Adams attempt to connect it with Hittite alwanz- ‘bewitched, affected by sorcery’ (1997: 60), but Kloekhorst finds it improbable on phonological grounds (2008a: 171).",Semitic: *ḥalíj- ‘sweet’,"There is not much that warrant a comparison since the formal resemblance is sporadic, at best, while the semantic unison of ‘sweet’ and ‘bitter’ is hopeful rather than substantially grounded; the proponent Dolgopolsky concedes the questionability of the comparison (1989: 7)."
