item,reconstruction_or_headword,gloss,attestations,notes,external_comparanda,discussion
62,*h₃or-(bh-),‘to change allegiance; heir; orphan’,"Hit. ḫarp- ‘to change allegiance, join’; (?)Toch. AB yerpe ‘orb, disc’; Lat. orbus; OIr. orb ‘heir, inheritance’; Goth. arbi ‘inheritance’, ON arfr ‘ox’; OCS rabŭ ‘slave, servant’; Gr. ὀρφανός; Arm. orb; (?)Ved. árbha- ‘small’","The Hittite e-graded verb form clearly points to an internal derivation in PIE, which is further substantiated by divergent semantic paths in the dialects. Kroonen convincingly posits Germanic ‘inheritance’ as a common judicial development with Celtic, which leaves Old Norse ‘ox’ and the derivative Gothic arbaiþs ‘labor’ in the same semantic field as the Slavic continuation (2013: 32f., cf. also Derksen 2008: 373). The formal similarity of Latin orbis ‘orb, disc’ and Tocharian AB yerpe ‘id.; image’ is connected here by Weiss (2006) and adds additional semantic variation to the root. Although Mayrhofer denies links to Hittite (1986: 119f.), Vedic appurtenance to this complex is highly probable and belongs semantically with Greek, Latin, and Armenian.","Semitic: Akk. arb- ‘fugitive, person without family’ North Caucasian: *Hu(r)bV̆ (~ -o-) ‘orphan, step-relation’ NE Caucasian: *hup V-HU: Hur. χu/ob-idi- ‘boy; calf’ Kartvelian: *ombol ‘orphan’ > Georgian obol-, Mingrelian ombol-Uralic: FU *orpa","The internal analysis of IE suggests that the meaning ‘orphan’ only developed late in PIE, and it is likely from these ultimate strata of the proto-language that Fenno-Ugric received the term; the lack of Samoyedic correspondences tacitly corroborates this analysis. Dating the transfer to Indo-Iranian times, as Joki does (1973: 297f.), is phonetically incompatible and semantically unlikely, although the meaning ‘orphan’ must be expected en route from late PIE to Vedic, ‘change allegiance’ → ‘orphan’ → ‘small’, which may have lasted well into the Indo-Iranian proto-language (cf. Weiss 2006: 256 fn.30). The North Caucasian reconstruction can similarly belong to this late PIE stratum which may secondarily include Kartvelian, as suggested by Dolgopolsky (1989: 8) and Nikolayev & Starostin (NCED s.v. ‘orphan’), although neither Fähnrich (2007) nor Klimov (1998) includes the form in their respective Kartvelian etymological dictionaries. The North Caucasian forms, distilled by Nikolayev & Starostin to the reconstruction *HubV̆ (NCED s.v.), similarly require the semantic specialization attained only in late PIE; Dolgopolsky here rightly notice the initial laryngeal (1989: 14). An alternative analysis could have the meaning ‘orphan’ enter late middle PIE from North Caucasian. The Hurro-Urartian form may either be connected to the pan-Caucasian exchange of the item, or, less likely, have entered independently from the Indo-Iranian superstrate of the Mittani kingdom; this latter hypothesis requires a significantly earlier transfer than the equestrian terminology visible in Hittite where the dialectal features are much more pronounced. Seemingly isolated within its own phylum, the Akkadian form may be connected with a different developmental strain of IE, either borrowing *arb(h)- or *orb(h)- (the language did not carry the phoneme o, cf. Buccellati 1997: 70). Depending on the philological details within Akkadian, a possible transfer could have been from some of the earliest contacts with Anatolian speakers, cf. Akkadian ‘fugitive’ with Hittite verb ‘to change allegiance, join’, which, of course, may not be the exact original meaning, cf. PIE *h₃ebh- ‘to turn’; the direct connection with ‘orphan’ suggested by Dolgopolsky (1989:8) is unnecessary, even more so the suggestion that PIE should have imported the term from proto-Semitic (Dolgopolsky 1989:14), for which there is no evidence. To maintain the distillation of the meaning ‘orphan’ as truly old in PIE, it requires alternative analyses with a dichotomy of the IE complex, separating at least the verbal root in Hittite, possibly also the otherwise attractive cognates in Germanic, Celtic, and Slavic from Latin, Armenian, and Greek. Ultimately, a case for a borrowing into late (middle) PIE with subsequent folk-etymological reinterpretation could be raised."
63,*h₃or-(n-),‘eagle’,"Hit. ḫāran-, Pal. ḫāran-, CLuw. ḫarran(i)- ‘bird’; (?)Middle Irish irar; Goth. ara; Lith. erẽlis; OCS orĭlŭ; Myc. o-ni-ti-ja-pi ‘of a bird’, Gr. ὂρνις ‘bird’; Arm. oror ‘gull’","Greek has inverted the inherited words for ‘eagle’ and ‘bird’ (*h₂euei-) so that the former means ‘bird’ and the latter ‘eagle’ (Mallory & Adams 1997: 173), while the Luwian shift is without consequence thanks to semantically more conservative inner-Anatolian cognates. Different derivations are required to account for all of the branches, but especially the *-n-desinence appears widespread and old, while Balto-Slavic are alone to extend with the *-l-formant. The appurtenance of the Celtic stock is tentatively questioned by Matasović (2009: 117f.). The distribution suggests early PIE origins, but the lack of Indo-Iranian and Tocharian cognates may indicate a more regionally confined phenomenon, cf. PIE *woin- ‘wine’ (item 133).","Semitic: *γVrVn > Akk. urinnu, Arab. γaran Sumerian: erin, (ḫ)u11-rí-in ‘e., standard’","The sporadic Semitic evidence could indicate a borrowing from an Anatolian language; Militarev & Kogan, who hesitantly propose this connection, also include Central Chadic ‘white-bellied stork’, that, however, more probably should be considered a later loan from Arabic (2005: 131); it may be added that the item is not included by Orel & Stolbova (1995), and that a connection between Akkadian and Sumerian seems solid (Sahala 2009: 6). Phonetically the value of PIE *h₃ is in play and the evidence does seem to point in a direction of ancient affinities, the question, of course, is how old."
64,*ieg-,‘ice’,Hit. eka; OIr. aig; ON jaki ‘piece of i.’; Lith. yže; (?)Wakhi yaz ‘glacier’,"Mallory & Adams suggest the Iranian comparanda (1997:286), and Turner further connects Kati, a Kafir language, yūċ ‘cold’, possibly related to Vedic śyai- ‘to freeze’ (1966: 38,601), which would require prefixation, and the Indo-Iranian branch remains unsecure. This does not change the fact that the strong evidence in Anatolian with sound cognates elsewhere establish the item for early PIE.","Uralic: FU *jäŋe > e.g. Fin. jää, Hun. jég","Formal and semantic identity makes this connection attractive. Although this comparison is usually included in the Indo-Uralic hypothesis (cf. Čop 1970: 158 and Collinder 1965: 124), the limited distribution of a geographically important item in Uralic suggests a later entry. Semantically this item may be compared with *wed-r ‘water’ (item 128) with pan-Uralic distribution."
65,*(l)iekʷ-r,‘liver’,"Lat. iecur; Middle Irish i(u)chair ‘fishroe’; (?)ON lifr; Latv. aknas (pl.f.); Gr. ἧπαρ; (?)Arm. leard; Ved. yaknás (gen.), YAv. yakarə-.","Aberrant forms in Armenian and Germanic with initial *l- have been suggested as stemming from internal analogies (cf. Martirosyan 2008: 267f. and Kroonen 2013: 336). Heterocliticon points, grammatically, to the very oldest strata of PIE, although attestations are wanting for both Anatolian and Tocharian.",NE Caucasian: *läHäƛ wV > e.g. Andian reƛ iƛ̱i,"Otherwise formally unattractive, S. Starostin does suggest that the East Caucasian form betrays the archaic nature of the initial consonant in Germanic and Armenian (2009: 83f.), conceivably continuing a borrowed palatalized *l- that was lost in the glide elsewhere. Chronologically a reconstruction through to North Caucasian form would strengthen its case, but all things considered this connection remains meagre."
66,*iug-o-m,‘yoke’,"Hit. yūk-; Lat. iugum; Old Welsh iou; ON ok; Lith. jùngas; Gr. ζυγόν; Arm. luc; Ved. yugám, Av. yugam.","One of the school-book examples of an IE cognate set, this root is only missing in Albanian and Tocharian, demanding a very ancient PIE provenance (cf. Mallory & Adams 1997: 655). While the Core-IE forms are transparent thematizations, likely derived from the verb *ieug- ‘to harness’ (LIV2: 316), the Hittite cognate demonstrably enters history as a root noun (Kloekhorst 2008a: 423).","NE Caucasian: *δ-uλ λ - > e.g. Dargi δykI Kartvelian: *uɣ-el > e.g. Georgian uɣel, Svan ūɣwa Semitic: *ǥull > Old Canaanite ḫullu, Akk. ullu ‘kind of pole’","According to Klimov, the Kartvelian comparanda represent an ancient borrowing from PIE (1998: 196, cf. also Deeters 1957: 390 and Nichols 1997: 146). Further comparanda have been suggested by Illich-Svitych to include NE Caucasian and Semitic (1965: 334f., continuing Dumézil 1933: 15), but while the former has some merit in the perfect semantic continuation, the Semitic branch is so removed in both meaning and form as to warrant caution. Kaiser & Shevoroshkin argue that the word entered Kartvelian from Semitic (1986: 369), but this trajectory is formally implausible and semantically discontinuous. Gamkrelidze & Ivanov suggest that even the Kartvelian suffix may come from PIE as Sanskrit, Homeric Greek, and Latin all have similar derivations (1995: 626), which, obviously, suggests that the transfer emanated from a late PIE, or even dialectal, strain. Diakonoff denies the direct comparison, preferring a North Caucasian origin for the term in Kartvelian (1985: 169fn.), but distributional patterns and the fact that a separate root accounts for most of the North Caucasian forms (cf. NCED s.v. ‘yoke’) certainly suggest a different entry."
67,*k̂er-(k̂er-),‘chickpea’,Lat. cicer; Alb. thjer ‘lentil’; (?)Gr. κριός; Mac. κίκκεροι; Arm. sisəṙn,"De Vaan rejects the Greek comparandum as a chance resemblance and tentatively posits the verbal root *k̂erh₃- (2008: 113). The widespread reduplication points to an old phenomenon (Greppin 1981: 6f.), and the Greek form, if connected, may thus be simplified. The distribution is very centralized in the circum-Pontic area, especially the Balkans, which may provide lexical evidence of an ancient Armenian presence in that particular region (cf. Solta 1960: 331f.).",NE Caucasian: *qarhV,"Dolgopolsky bases his loan trajectory (PIE → NC Caucasian) on paleobotanical arguments (1989: 16), but the linguistic side certainly does not warrant a reconstruction for PIE. A similar root is visible in NW Caucasian with the meaning ‘pea’, and a pan-North Caucasian phenomenon is substantiated by similar items in all branches, of which Abkhaz and Kryts show reduplication (Mikić & Vishnyakova 2012). A further comparandum is suggested in Burushaski gərk ‘peas’ and thus shows hallmark signs of a wanderwort scenario. A reconstruction for PIE looks more like an example of biased science than a valid inference of the scattered and inconsequent IE data, unfortunately prompting an indefensible conclusion on directionality."
68,*k̂ér-(h₂/u-),‘horn’,"Hit. karāwar; Toch. B krorīya; Lat. cornum; Gaulish κάρνυξ ‘trumpet’; Goth. haúrn; Latv. sirna ‘roedeer’; Myc. ke-ra, Gr. κέρας; Arm. ełj̆ewr; Ved. śŕ̥n-ga-.","This set of cognates is widespread, but reflects a number of different derivations (Mallory & Adams 1997: 272f.) and sometimes also means ‘head’. The present discussion refrains from further treatment of the derivations as long as the very ancient nature of the root can be established with internal evidence alone. For an in-depth scrutiny, see Nussbaum (1986).",Semitic: *ḳar-n- < Afro-Asiatic *ḳar-,"Further Afro-Asiatic comparanda in Egyptian ḳr.ty (dual) and Omotic [ḳ]ar (Orel & Stolbova 1995: 337) actually suggest loan from Afro-Asiatic → PIE, although the n-derivation is only known from Semitic. The fact that PIE and Afro-Asiatic both share the stem form, while Proto-Semitic only betrays the n-extended form also known in PIE does suggest some correlation, the exact nature of which, however, is difficult to pinpoint, including the conditions conducive for the transfer of such a common item that must have played an important role already in hunter-gatherer communities. Gamkrelidze & Ivanov (1995: 773) adduce from the material that Semitic borrowed its term from PIE, but the internal evidence of Afro-Asiatic is problematic for this analysis. It remains, however, difficult to extricate the relationship since both families have an identical development of original *KVr- > *KVr-n-. Similar seemingly inexplicable parallel phenomena are observable also between Kartvelian and PIE in the word for ‘wine’ (item 133)."
69,*k̂er-d-,‘heart’,"Hit. kir, CLuw. UZUzārt-; Toch. B käryāñ (pl.); Lat. cor; OIr. cride; Goth. haírtō; Lith. širdis; OCS srŭdĭce; Gr. κῆρ; Arm. sirt; (?)Ved. hŕ̥d-, (?)Av. zərəd-","The root is indisputably reconstructable for the oldest stratum that may be arrived at with internal evidence alone. Formally the Indo-Iranian initial velar is incompatible with the rest of the stock, which prompts Mayrhofer to dismiss the connection altogether, preferring instead Ved. śrád- (II:818), which, indeed, trumps the voiced option. This anomaly does not question the ultimate fate of the reconstruction. A thorough treatment of the forms is given by Szemerényi (1991:172-190).",Kartvelian: *m̥ -k’erd- ‘chest’ (Klimov 1998:123) or *ḳward (Fähnrich 2007:234),"The Svan comparandum (Klimov məč̣ wed, muč̣ od ‘chest’; Fähnrich ḳward-wim ‘body, hull’) is contended which brings the initial *m-, as reconstructed by Klimov, into question. Fähnrich’s reconstruction seems preferable as it dispenses of the prefix that appears productive in nominal formations (cf. also Klimov 1998: 111f.). This PIE-Kartvelian comparison may be grouped with *h₁esh₂-r ‘blood’ (item 33) that falls within the same semantic category, albeit with significantly less appealing formal correspondences. The comparison is, altogether, convincing, despite the slight semantic shift."
70,*k̂seh₁-ro-,‘dry’,(?)Toch. A ksär ‘in the morning’; (?)Lat. serēnus ‘clean’; (?)OHG serawēn ‘weaken’; Gr. ξερόν; (?)Arm. čՙor; (?)Ved. kṣārá-,"Only the Graeco-Aryan cognates are secure according to Mallory & Adams, who assume it derived from *k̂seh₁- ‘to burn, singe’ (1997: 170), but Mayrhofer rejects the appurtenance of the Vedic item to this group (1989: 430), and there are formal quantitative problems with the vocalism in the European languages (Beekes 2010: 1035f.). Excluding the elusive Tocharian form (cf. Adams 2013: 199), the whole set is accepted by Solta (1960: 234), but a clear picture cannot be drawn at present.",Uralic: *kośke > e.g. North Saami goikat and Mordvin kośke,"Sammallahti suggests that the Uralic form continues a borrowing from PIE (1998: 118). The meaning ‘dry’ is not evident in the oldest layers of PIE as it is only continued in Graeco-Armeno-Aryan, and the general confusion as to the exact appurtenance of the IE forms further hampers a clear chronological stratification. All older layers betray meanings that, at best, may continue the verbal root suggested by Mallory & Adams (1970:170), although this remains speculative. The semantics thus tentatively suggest that the item transferred into Uralic from late PIE."
71,*k̂seul-,"‘beam, post, piece of wood’","Goth. sauls ‘column, post’; Lith. šùlas ‘post, jamb, doorpost’; Rus. šúla ‘garden post’; Gr. ξύλον, var. σύλον.","Several aspects make the native status of this item highly questionable, including the atypical onset cluster, the very specific meaning in all attestations, and the distribution limited to a small handful of (nearly contiguous) European branches (cf. Beekes 2010: 1037f.).",NE Caucasian: *č̣ ɨwłu ‘beam’ > e.g. Chechen č̣ erg ‘transversal ceiling crossbeam’,"The phonetic shape of this reconstruction certainly seems to correspond with the reception in the IE languages, and the superimposable semantics bolster this scenario. Somewhat problematic is the geographic distance between the IE languages in Europe and the NE Caucasian family, but the fact that prehistoric migrational patterns, of people and, especially, words remain ephemeral, this cannot be elevated to a decisive counter-argument when, on linguistic evidence alone, the comparison is so attractive. Given the lack of internal explanation for the item in PIE, the item may well have emanated from NE Caucasian, as suggested by S. Starostin (2009: 97), or a language related hereto."
72,*k̂won-,‘dog’,"Hit. LUkuwan-/kun- ‘dog-man’, HLuw. zú-wa/i-n(i)-; Toch. A & B ku; Lat. canis; OIr. cū; Goth. hunds; OPrus. sunis; Rus. súka ‘bitch’; Gr. κύων; Arm. šown; Ved. śva ́-, Av. spā-.","An early extension of the root accounts for the Germanic stock, which is comparable to Latvian sùntena ‘big dog’ and Armenian skund ‘small dog’ (Mallory & Adams 1997: 168), but this formation need not be old. It may be noted that there is a different treatment of the sequence *k̂w- in the centum languages than in ‘horse’ (item 32).","Uralic: *kVn- > e.g. Selkup kanan, Udmurt kyjon, North Saami gaidne ‘wolf’ Yukaghir: *keδe ‘wolf, dog’","The semantic gap from ‘wolf’ to ‘dog’ is hardly insurmountable, cf. that the shift also occurs in certain IE branches (Mallory & Adams 1997: 168), and the somewhat scanty attestations from across the Uralic pallet (Samoyedic, Volgaic, and Saami) may thus be considered likely comparanda. Chronologically the Uralic proto-language is required, making a transfer from dialectal IE implausible. The term may have migrated as far as China, where, according to Gamkrelidze & Ivanov, it was adopted around the middle of the second millennium BCE, cf. Old Chinese k’iwen (1995: 507), but this, obviously, has to be seen as a secondary transfer, possibly from Proto-Tocharian. This protracted journey suggests that an earlier loan into Uralic from PIE is probable, although the relative scarcity of Uralic material makes an exact reconstruction difficult, which further makes the comparison with exact IE strata difficult; that it cannot be compared to a satəm continuant, e.g. Indo-Iranian, is, however, very clear. This comparison requires that Selkup k- is the reflex of PIE *k̂- (cf. the discussion of ‘catfish’, item 78), and a case for an Indo-Uralic item could easily be assembled."
73,*kaĝo-,‘goat’,"Old Low German hōken; OCS koza; Alb. kedh, kec ‘kid’",Very limited distribution questions ancient PIE moorings for this item. Connections with PIE *h₂e(i)ĝ- (item 40) are formally impossible (cf. Mallory & Adams 1997: 229). The reconstructed a-vocalism is noteworthy.,NE Caucasian: *q oVcV > e.g. Lezgian ʁec,"The Slavic forms may, according to Derksen, be borrowed from a Turkic language relatively late (2008: 242), ostensibly within the first millennium CE. S. Starostin proposes this Northeast Caucasian connection (2009: 81), but the formal correspondence is not very attractive."
74,*kə2p-,"‘monkey, ape’",(?)Celt. abrános (Hes.); (?)ON api; (?)ORus. opica; Gr. κῆπος; Skr. kapí-,"The forms are obviously incompatible, agreeing only barely in the internal labial stop, which naturally prompts Mallory & Adams (1997: 384f.) to deny that the PIE lexicon should have had a term for ‘monkey’, corroborating the lack of convincing cognates with palaeozoological and archaeological evidence; that Sanskrit and Greek likely ultimately are related rests on a common donor language. Gamkrelidze & Ivanov’s suggestion that the word should be of PIE origin (1995: 442) is consequently bordering the preposterous.","Semitic: Akk. uḳūpu, Heb. ḳôp a, Aram. ḳōp ā Egyptian: gif","There is little doubt that this item represents a later loanword in a few IE branches, as suggested by Mallory & Adams (1997: 384f.), and although it may thus ultimately be related to the Semitic (and Egyptian) forms in question, it is beyond the scope of the current investigation and hardly an argument in the discussion of the location of an ostensible PIE homeland."
75,*kist-,‘container’,"Welsh cest ‘hull, basket’; Gr. κίστη ‘box, chest’","Only possibly inherited in Celtic and Greek, the term has demonstrably travelled as a loan across the European branches of IE, cf. Old High German kista, Latin cista, and even Irish ciste (Beekes 2010: 705). It is thus conceivable that the older Celtic layer also represents an item culturally transferred through borrowing.",Semitic: *kīs ‘small bag’,"Weak IE evidence makes a PIE item highly unlikely, and the grammatical derivation (*-at) suggested as the proof of its origin (Dolgopolsky 1989: 8) is not documented in Semitic. The forms may be connected, but it is not relevant for PIE and consequently beyond the scope of the present paper. A comparable item of trade is PIE *kʷer- ‘kettle’ (item 83)."
76,*kleh₂-u-,"‘lock, key’",Lat. clāvis; Welsh clo ‘bolt’; Lith. kliu ́ti ‘to get stuck’; OCS ključĭ; Gr. κλᾱΐς (Doric),"The age of the item within PIE is questioned by the lack of Anatolian and Tocharian comparanda. A tentative connection with the verbal root *kleh₂- ‘to strike, beat’ is formally attractive, but requires some semantic qualification, possibly from the action of barring a door.","Semitic: *k-l-’ ‘to detain, lock’ > e.g. Akk. kalû, Ge’ez k-l-’, Arab. kala’a ‘guard’ Kartvelian: Old Georgian klite North Caucasian: *ḳułɨ- > e.g. Lak k’ula","Gamkrelidze & Ivanov proposed that PIE borrowed the term from a Semitic source (1995: 771), but the semantics are, perhaps, a bit too loosely affiliated to warrant the loan relation of a concrete cultural item (Diakonoff 1985: 123f.), and the phonetics may similarly be questioned as major root restructurings are needed for the IE forms to continue the attested Semitic forms (cf. Mallory & Adams 1997: 272). Old Georgian is convincingly ascribed to a late borrowing from Parthian *klīt, ultimately from Greek (Diakonoff 1985:124), but the sporadic yet consistent attestations in the North Caucasian languages may convincingly posit the root as an attractive item, cf. also Hattic kaluḫ ‘bolt, bar’ (S. Starostin 2009: 96). Matasović denies the connection because of the internal PIE derivation (2012: 289), but if that derivation is questioned, perhaps in light of folk-etymological association or a secondary denominal verb formation, it renders an external connection more attractive; the formal and semantic likeness certainly makes a rejection hard to substantiate."
77,*kond-u-,‘hand’,Goth. handus,"However widespread in Germanic where it is the primary word for ‘hand’, the distribution is severely limited. According to Kroonen, it is derived from the Germanic verb *hinþan- ‘to reach for’ (2013: 207f.). It is generally difficult to establish a common PIE word for ‘hand’ as several substitutions demonstrably have occurred (cf. Ringe et al. 2002: 73f.), although *ĝhés-r- seems to have solid evidence in Anatolian, Tocharian, and Greek.",Uralic: FU *käti > Fin. käsi,"Schrijver actually posits a lost substratum language as the origin of both the Fenno-Ugric and the Germanic forms (2003: 223), and the etymology is consequently beyond the scope of the present paper."
