item,reconstruction_or_headword,gloss,attestations,notes,external_comparanda,discussion
92,*médhu-,‘mead; sweet’,"(?)Hit. mitgaimi- ‘sweetened’, Toch. B mit ‘honey’; OIr. mid; ON mjo̜ðr; Lith. medùs ‘honey’; OCS medŭ ‘honey, wine’; Gr. mέθυ ‘wine’; Ved. mádhu- ‘honey, wine’; Av. ma𝛿u ‘berry wine’.","With comparison to the PIE word *mélit- ‘honey’, it seems clear that already in PIE times the current item had a distinct meaning, requiring that the semantic shifts to ‘honey’ in Tocharian, Lithuanian, Old Church Slavonic, and Vedic can be explained by synecdoche (Mallory & Adams 1997: 271). The suggested Hittite cognate is used to describe bread, but is not the primary word for ‘sweet’, perhaps borrowed from an unattested Luwian formation.","Semitic: *mVtḳ- ‘sweet’ (Nichols 1997: 143) NE Caucasian: *miʒʒV ‘sweet’ > e.g. Ingush merza Uralic: *mete ‘honey’ (Thomsen 1869: 2, Wiklund 1906: 63)","Orel & Stolbova connects Semitic with the almost identical Central Chadic *mVtak- ‘sweet’ (1995: 393), sufficiently removed on the other side of the Sahara to substantiate Afro-Asiatic origins, which has consequences for the reconstruction in PIE, e.g., how a received *-tḳ- is organized into the native phonological system; in this Gamkrelidze & Ivanov’s analysis seems convincing (1995: 771), despite Diakonoff’s scepticism (1985: 129). The disputed Hittite form may be a secondary entry directly from a Semitic source. The NE Caucasian forms could alternatively represent an intermediate step; the prefixed version *hwi-miʒʒV ‘honey’ certainly qualifies the semantic connection. The internal PIE connection to *mélit- ‘honey’ is thus likely to be ascribed to chance; cf. Bomhard & Kerns for a primordially Nostratic connection to Afro-Asiatic (1994:657). The Hittite form may even be an independent and later loan from Semitic (Tischler 1990:221), separating the IE stock and possibly granting a relative chronology of the term. The Uralic connection is obvious and has been proposed as a loan by, e.g., Koivulehto (1993:184), but the exact stratum for a transfer is disputed. Although a number of IE loanwords in Uralic can be diagnosed convincingly as Indo-Iranian (§ 1.3.2.13), this cannot be extended to this stratum on linguistic grounds. Napolskikh’s invocation of a Proto-Tocharian or, alternatively, Proto-Balto-Slavic form to account for both semantics and vocalism (2001: 372) seems convincing, the former especially so when confronted with the seemingly strong cultural force it yielded, cf. thus similarly Old Chinese *mjit ‘honey’ (Lubotsky 1998). The only linguistic evidence directly against a loan from PIE proper is the lack of Samoyedic cognates to the root, which, too, may prove problematic for the Tocharian relation (cf. also items 52 and 109), although, on the other hand, it is conceivable that the term was simply lost in proto-Samoyedic (cf. Joki 1973: 283ff.). With the word seemingly also entering the NE Caucasian languages, the cultural dispersal hypothesis is attractive in light of the similarly shaped comparanda in many other languages (e.g. Japanese mitsu). The circumstances, including time and space, for such a spread need to be further interdisciplinarily investigated before conclusions can be drawn. A tentative hypothesis may be to consider PIE the recipient of a different strain of a, perhaps, ancient root parallelly passed down directly to PIE *mélit-."
93,*mesg- > *mezg-,‘to submerge’,Lat. mergere; Lith. mazgóti ‘to wash’; Ved. majjáyati.,Limited distribution questions the antiquity of the root in PIE.,"Uralic: *mośke ‘to wash’ > e.g. Hun. mos-, Proto-Samoyed *måsȇ","Semantically the very strong Uralic evidence only corresponds directly to Baltic, although a shift from the less specific meaning reconstructed for PIE is not impossible. ‘Washing’, or ‘submerging’, seems an odd action to import linguistically, but cannot be ruled out on a theoretical basis alone. Voicing is the one feature that sets the IE material apart as more complex and consequently as the most likely origin of a borrowing; this notion may be similarly supported by what appears to be a hint of indecisiveness on the quality of the first vowel in the Uralic languages (UEW 289). A borrowing in the opposite direction, from Uralic into late middle PIE, is warranted by the distributional patterns."
94,*misdʰo-,‘payment’,"Goth. mizdō; OCS mĭzda; Gr. μισθός; Skt. mīḍha-, Av. mižda-","Kroonen considers it a combination of the the two verbal roots *dʰeh₁- ‘to put, place’ (item 11) and *mi(s)- ‘to exchange (gifts)’ (2013: 370), the latter ultimately continued from Persson (1912: 326fn), which makes semantic sense but the final *s required for all attestations is not substantiated. The item is comparable to the similar compound in *k̂red-dheh₁- ‘to put on the heart > trust’ in Lat. crēdō, Welsh credu, Ved. śraddhā-, Av. zrazdāiti (cf. de Vaan 2008: 141f.). There are two obvious inconsistencies that both pertain to grammatical categorization: Firstly, the first component is obviously nominal in this latter construction, while *mei- is a verbal root; this could, however, be offset by the derivation required for the coda that may be be expected to be nominal. Secondly, a demonstrable verbal basis for *misdʰo- would have strengthened the case for this scenario, but all continuations seem to find their simplest form in the nominal category (cf. Beekes 2010: 957f.). The exact etymology consequently remains controversial, and the distribution precludes reconstruction to the oldest strata, but may safely be posited for middle PIE.","North Caucasian: *maśwV ‘worth, trade’ > e.g. Archi mas","S. Starostin proposes an alternative to the analysis of the first item as a native element by positing the North Caucasian comparandum (2009:100), but the NW Caucasian languages show great semantic discontinuity to (or, as S. Starostin suggests, from) ‘ram’. Semantically the connection is viable as an item related to trade relations and would provide a nominal first element to the PIE compound. This scenario requires that the import seemingly exclusively was employed in this collocation, which is not entirely inconceivable (cf. the possible fate of PIE *dek̂m̥ ‘ten’ in Uralic, § 5.10), but, more problematically, the formal correspondence is incompatible in the vocalism. This ultimately renders the comparison improbable."
95,*moro-,‘blackberry’,(?)Lat. mōrum; (?)Welsh merwydden ‘mulberry’; Gr. μόρον; Arm. mor,"Welsh may, like the more secure cases of OHG mūrbeere ‘mulberry’ and Lithuanian mõras ‘id.’, be a loan from Latin, that again may have transferred from Greek (Schindler 1964: 172); Beekes even suggests that the Armenian cognate be borrowed from Greek, too (2010: 968), which would render it solitary in Greek, but this idea is rejected by Martirosyan (2010: 474ff.). Despite the resemblance of Hittite mūri(yan)- ‘grape’ (Tischler 1990: 233f.), there seems to be no reason to posit the noun for the oldest layers of PIE.",NE Caucasian: *mer(ʔ)V ‘a kind of berry’ Uralic: *mura ‘cloudberry’,"The Uralic stock is exceptionally consistent both formally and in terms of semantic scope, which suggests that the word entered (P)IE from Uralic. There is hardly a semantic gap between the cloudberry of Uralic and the black- and mulberries of IE that all resemble each other, and the fact that the cloudberry (also called arctic raspberry) is confined to very northern latitudes practically forces a shift. The item was also borrowed into Turkic and Tungusic languages, probably from Ob-Ugric, and later even Russian (UEW 287), so the directionality is certainly established. Campbell also posits the more general FU *marja ‘berry’ as related in a wider complex (1990: 165f.), but enough of a connection can be drawn from the more immediate resemblances. Nikolayev & Starostin have showed that a similar noun is of significant age in the Northern Caucasus (NCED s.v. ‘berry’), but the vowel quality seems better to have been affected by a desinential *-i- somewhere, possibly the derivation for the associated bush or plant (cf. Martirosyan 2010: 474ff.). Friedrich similarly suggests that Burushaski biranč may be connected (1970:150) and thus substantiates a widespread root. A transfer likely happened into a very late stage of PIE, if not purely dialectal; the geographic distance between the Uralic languages and the attested Greek and Armenian is obviously insurmountable, as noted by Joki (1973:287f.)."
96,*néh₂-u-,‘boat’,(?)Toch. A new ‘flood’; Lat. nāvis; OIr. nāu; ON nór ‘ship’; Gr. ναῦς; Ved. nāu-,"It has been suggested that the noun is derived from the verbal root *(s)neh₂- ‘to swim’ (LIV2: 572f.) with convincing cognates from Anatolian, too, which seems semantically cogent, but curiously lacks reflexes of the initial *s- of the root. Amble evidence thus suggests an internal derivation after the breakup of Anatolian, and likely also Tocharian.","Semitic: *’unw-(at-) > Ugaritic ‘anyt ‘ship’, Arab. ‘inā’- ‘vessel’","Gamkrelidze & Ivanov suggest that the term was borrowed into PIE from Semitic (1995: 771f.), but, due to the proposed internal PIE derivation, Mallory & Adams’ rejection of this comparison (1997: 74) seems well-founded (cf. also Diakonoff 1985: 125). *(h₂)nepōt ‘nephew’, see item 53 under *h₂-"
97,*(h₃)ok̂tṓ ‘eight’ (see § 5.8),,,,,
98,*peh₂-,"‘to protect’ IE cognates: Hittite paḫ-s-; Toch. B pā-sk- ‘to look after, watch’; Lat. pā-sc-ō (pā-vī) ‘to graze’; OCS pa-s-ti ‘to pasture, to look after’; Ved. pa ́-ti ‘protect, keep’.",,"The root shows different extensions along with the root form, but semantics render the assemblage impeccable. Hittite requires the extension *-s- also present in the Italic and Slavic forms, yet common Anatolian may also retain the bare stem in Luwian pád-du ‘may he protect’ (Kloekhorst 2008a: 612).","NW Caucasian: *px̆a 'authority, respect, honor' (Bomhard 2015: 43)","Extra-familiar connections to NW Caucasian has been suggested by Bomhard (2015: 43), but semantic as well as formal connections are dubious, and the pure “Pontic” connection is hardly substantial."
99,*peh₂-u-,‘son’,(?)Lat. puer; Goth. fawai ‘few’; Gr. παῖς; (?)Ved. putra,"Despite internal problems, there is little doubt to the reconstruction of a PIE root *peh₂-, but with the original adjectival meaning ‘few, little’ (Beekes 2010: 1142f.). Inclusion of Vedic would require an instrumental derivation *-tlo-.",NW Caucasian *pa 'son; to rear',"Colarusso suggests a Proto-Pontic form *pa with an unexplained *-w- extension to account for the IE material (1997: 144), but the fact that semantic divergence increases, and not diminishes, as one moves towards the PIE reconstruction, the comparison is weak and founded on shallow resemblance, at best."
100,*peisk-,‘fish’,Lat. piscis; OIr. íasc; Goth. fisks; (?)Czech pisk ‘young feather’; (?)Ved. piccha ‘id.’,"The semantic gap to the Slavic and Indic forms appears insurmountable (cf. Kroonen 2013: 142), and the attestations thus point to a western regionalism.",North Caucasian: *p VśwV- > e.g. Tsezian besuro,"The comparison requires the IE forms to have been extended with a k-suffix (S. Starostin 2009: 83), but despite the perfect semantic match, the formal side is insufficiently founded. From the point of view of the IE attestations, an external source is attractive to explain the innovation, but there is not enough compelling evidence to establish this North Caucasian comparandum as the source."
101,*pek̂u-,,"Lat. pecu; Goth. faíhu; (?)Lith. pekus; Ved. páśu-, Av. pasu.","The Baltic forms fail to reflect the palatal development of the internal obstruent as formally expected, and may have to be considered secondarily borrowed from a centum language (Mallory & Adams 1997: 23), conceivably Germanic, but similar discontinuations of satəm traits are not unheard of in Baltic. Certainly of PIE origin, the lack of Anatolian and Tocharian cognates renders the oldest stages beyond the reconstructional reach of prudent scholarship.",North Caucasian: *p äHäƛ wV,"The comparison, proposed by S. Starostin (2009: 82), appears formally strained, although semantics and the host of other proposed comparanda concerning livestock, primarily ‘goats’, purportedly emanating from the Caucasus adds circumstantial plausibility to a borrowing."
102,*pelek̂u-,‘axe’,"Myc. pe-re-ke-we, Gr. πέλεκυς; Ved. paraśú-, Oss. færæt","The distribution is limited to Graeco-Aryan, so only barely late PIE, although decisively so as it predates the phonologically distinctive split between the former constituent as centum and the latter as satəm. The item later entered Tocharian through an Iranian language.","Semitic: *p-l-ḳ ‘split apart, axe’","The item is also found in the Tungusic and Mongolian languages, still purportedly with Semitic as the ultimate origin (cf. Poppe 1953), and also eventually wound up in East Caucasian through an Iranian source (NCED s.v. ‘axe’). Similar late borrowings introduced descendants of the term to the Fenno-Ugric languages in the greater Volga region, most likely also from an Iranian source (Joki 1973: 305f.). These trajectories surely bolster the attractiveness of a loan relation also into late PIE. The item is somewhat shakily connected with a Berber term meaning ‘blade’ by Orel & Stolbova (1995: 423f.), while Militarev include Chadic cognates, all with the common meaning ‘stone’ (2006: item 287) to further substantiate an Afro-Asiatic origin of the term. Semantically the journey seems admissible, albeit not from the most often cited form, Akkadian pilaḳḳu, due to the simple fact that it means ‘spindle’; this prompts Diakonoff to reject the connection on semantic grounds (1985: 125f., cf. also Beekes 2010: 1166f. and Fortson 2010: 79), but an Akkadian source is not excluded altogether as the same trilateral root is employed with a different vowel makeup to form puluḳḳu with a secondary meaning ‘a sharp tool’, attractive in light of the desinental vocalism (see also Gamkrelidze & Ivanov 1995: 620f.), but less so semantically. Other attested Semitic languages (ibid.: 771) show perfect semantics in ‘axe’, but fail to provide the vocalic material that could justify a u-stem in Graeco-Aryan. The overall attractiveness of a triconsonantal lexical item perfectly semantically mirrored in a limited and very probable subgrouping of PIE makes the connection uncircumventable; its proven track record of borrowing similarly adds credibility to this analysis, but the exact trajectory likely involves undocumented intermediaries. The item evidently does not belong to the earliest stages of PIE, only with clear reflexes in Graeco-Aryan, but needs to be posited sufficiently early to account for the developments discussed; for an in-depth treatment including archaeological discussion, see Makkay (1998)."
103,*pelh₁-,"‘to swing, shutter’","(?)Lat. populus ‘population’, (?)Umb. poplom ‘militants’; Goth. us-fil-ma ‘frightened’; (?)Slovenian pó ljem ‘undulate’’; Gr. πελεμίζω ‘to shake, cause to tremble’.","The distribution is limited and semantically difficult, although the Italic forms gain credibility in light of the Greek nominal derivation πόλεμος ‘war’, ostensibly from ‘(lance) wielding’ (LIV2: 469).","Uralic: *pele ‘to fear’ > Saami balla, Proto-Samoyed *pij-","Collinder considers it a sign of deep ancestry (1965: 126), while Koivulehto proposes a loan directly from PIE (1994, 2001: 236). Finnish pelkää ‘id.’ is likely related, and the extension then the reflex of PIE *-h₁ (ibid.). Semantics, however, pose a problem as the suggested Uralic borrowing does not seem to represent the original meaning ‘swing’; the fact that Germanic and, in particular, Greek only secondarily have developed into ‘fear’ is of serious detriment to the comparison. The most probable IE point of departure would be the earliest possible detachment of the stock to which Proto-Germanic belonged. This analysis could allow for a semantic drift while retaining laryngeal features."
104,*pen(kʷ)-sti-,‘fist’,PIE *penkʷe ‘five’; OHG fūst; Lith. kúmstė; OCS pęstĭ; (?)Gr. πέμπω ‘to send’,"The provenance of the Greek evidence is elusive (cf. Chantraine 1968: 879f. and Beekes 2010:1170), and it begs the question how a root with seemingly defined verbal and nominal connotations was lost on such a massive scale. The connection with *penkʷe ‘five’ (§ 5.5) is straightforward, semantically as well as formally, and the limited distribution of this derivation is then isolated to the derivation as all IE branches, with the possible exception of Anatolian, continue this numeral. The velar does not have any obvious reflex in Germanic and Balto-Slavic, and may only be included to satisfy the traditional reconstruction of PIE ‘five’, so that the *-kʷ- here may be considered optional in the cluster *n-(kʷ)-st-; this formation may even be secondary to the grammaticalization of *-kʷe in PIE ‘five’ (cf. Mallory & Adams 1997: 255), and thus wholly without consequence for this discussion. If Germanic *fingraz ‘finger’, however, belongs here, the velar becomes evident in the anatomical stock (cf. Kroonen 2013: 141).",Uralic: *piηз ‘palm of the hand’ NE Caucasian: *χwinḳwV ‘fist’,"Semantically the Uralic connection is awkward unless the point of tangency is something like ‘the fingers’, then either clenched or spread out, and the trajectories would, rightfully, have to be connected only very early (Čop 1970: 161, cf. also discussion in § 5.5). A loan from PIE to Uralic seems most probable if the velar element is secondary in PIE, while a reconstruction to the root would level the playing-field. The Caucasian connection has far better semantic prospects but rests on an alternative interpretation of the IE data, viz. that the obstruent sequence in the Italo-Celtic continuation of ‘five’ is the original, but such a scenario requires widespread and independent, yet identical, dissimilation, across the IE branches which is highly improbable. Alternatively, the item should have been borrowed into a dissipating PIE dialect continuum where the initial cluster from NE Caucasian was incorporated independently, but such conjectures remain extremely speculative and would punctuate the otherwise convincing continuity of PIE ‘five’."
105,*pes-,‘penis’,"Hit. pesn- ‘male’; Toch. B paṣe ‘hare’; Lat. pēnis; OHG fasal ‘seed, descendant’; (?)Czech o-peska; Gr. πεός; Ved. pásas-.","While de Vaan questions the Latin item’s place within this particular cognate set (2008: 458), different suffixes (Hit. and Latin *-n-; Graeco-Aryan *-os) indicate IE derivation from a common root, whose actual semantic basis has yet to be determined. The inclusion of the Czech form is dubious, while Tocharian, though semantically off, has scholarly erudition on its side (Adams 2013: 387). The possibility of a late Core-IE, perhaps exclusively Graeco-Aryan, semantic derivation may thus explain the distribution.",Uralic: FU *paćɜ,"A loan into FU is not impossible, although the distribution in only Saami buoččâ and Hungarian fasz (with early attestation, c. 1380) demands caution. Further, the distributional pattern does not warrant a significantly old transfer as to compare with PIE. Takács also posits the PIE term as the origin of Dravidian (with questionable semantics) and Old Uighur äs < *päs (1997:373). Given the semantic nature of the term, nursery-word phenomena cannot be excluded, while the conditions under which it ostensibly should have been borrowed are difficult to ascertain, so that any formal conclusions must consequently be suspended. The internal IE evidence alone similarly suggests that if a borrowing occurred, it postdates the split of Anatolian and Tocharian, and may even be attributed to the very last stratum that with the slightest grain of scientific merit could be dubbed PIE, i.e. Graeco-Aryan."
106,*pə2-ter-s,‘father’,"Toch. A pācar, Toch. B pācer; Lat. pater; OIr. athair; Goth. fadar; Gr. πατήρ; Arm. hayr; Ved. pitár-, Av. ptā-.","The word father in almost all of the IE languages correspond neatly, yet some languages betray, sometimes alternating, a nursery word, e.g. Gothic atta and Hittite attas, but the matter is further cmplicated by the long-held etymology that the father is actually the ‘defender’, i.e. PIE *pə2-ter-s is derived from the verbal stem *peh₂- ‘to protect’ as evident in Hittite paḫs- and Toch. B pā-sk-, etc. (item 98). The root may, indeed, betray the internal formation of the formal head of the family cf. discussion in Benveniste, who rightly attributes special functionality to the more complex form (1969: 209-212). The complete absence of the otherwise prolific *pə2-tér-s in Anatolian could be explained as simple lexical loss, although it seems unlikely as not a single trace is left of it; the situation in core-IE is more easily explained if the term is an innovation: The abandonment of the lexeme is rare and it almost certainly requires a strongly institutionalized functionality to withstand the constant encroachment Lallwörter necessarily presents (ibid., although with opposing view of the fate in Anatolian). The formal term for ‘mother’ *meh₂-ter- is, while clearly related, likely secondarily derived from the masculine; its distribution roughly mirrors that of ‘father’, including the important absence from Anatolian.","NW Caucasian: *px̆a 'authority, respect, honor' (Bomhard 2015: 43)",The external comparanda is treated under the entry *peh₂- ‘to protect’ (item 98).
107,*(h₁)reugh-,"‘sour-milk, butter’","ON rjúma ‘cream’; (?)Lith. ráugas ‘sourdough, acid,’ (?)Latv. raûgs ‘yeast, lye’, (?)OPrus. ructan-dadan ‘sour-milk’; Av. raoγna-","The Baltic forms are traditionally ascribed to a different set of cognates (cf. Fraenkel 1965: 705f.), but certain collocations seem to indicate that the inherent meaning did, indeed, pertain to dairy (Schmalstieg 1976: 278f.). The distribution limited to Germanic, Iranian, and likely Baltic is suspicious, but otherwise the connections appear to be reasonable. The initial laryngeal is posited to avoid a solitary *r- in the onset, but is not directly warranted by any of the attestations.",North Caucasian: *renχwV- > e.g. Budukh juχ ‘milk’ (S. Starostin 2009: 103),"Formally this connection requires that PIE *-Vgʰ- is represented by North Caucasian *-nχ-, which is not inconceivable. More important, however, is the apparent mismatch of categories, where the nominal forms in Germanic and Avestan have derivational suffixes, suggesting a verbal basis, whereas the North Caucasian comparanda, supposedly exported, are basic nouns. Representing a certain technique in the treatment of dairy, this item is comparable to *twer- ‘curdled milk, curds’ (item 125), and can roughly be assigned the same distributional patterns. The connection, though tantalizing, requires further circumstantial evidence. *(h₁)raudh- ‘copper’, see item 38 under *h₁- *(w)ruĝh- ‘rye’, see item 135 under *w-"
108,*sekur-,‘battleaxe’,Lat. secūris; OCS sekyra,"The Latin term is easily ascribed to a nominal derivation to the verb secō’ to cut, sever’ (e.g. de Vaan 2008: 550f.), and a similar formation may be posited for Slavic (cf. von Miklosich 1970: 290 and Vasmer 1955: 603), but the exact derivation of either remains obscure. There is no evidence pointing to an old item within PIE.","Semitic: Akk. šukurru ‘javellin’, Heb. seḡōr","Gamkrelidze & Ivanov suggest that the term was transferred into (P)IE from a Semitic language (1995: 771), though possibly ultimately from Sumerian (cf. von Soden 1981: 1266). The semantic discontinuity (Diakonoff 1985: 126) and the possibility of internal derivation in Latin and Slavic makes the connection untenable, although the effects of folk-etymological reinterpretation cannot be excluded as the primary factor in connecting a borrowed ‘axe’ with the native *sekʰ1- ‘to cut’. Most probable, however, seems a transfer into Old Latin (cf. Makkay 1998: 183 fn.3) that continued to the proto-Slavic speech community."
109,*septm̥ ‘seven’ (see § 5.7),,,,,
