pdf_page,line,headword_segment,entry_opening
570,8020,"\*þa- pron. 'that, those'","\*þa- pron. 'that, those' - Go. sa, acc. þana, f. so, acc. þō, n. þata pron. 'id.', ON sa, acc. þann, f. su, acc. þā, n. þat pron. 'id.', Far. tann, n. tao pron. 'id.', OE se, acc. þone, f. seo, sio, acc. þā, n. þæt pron. 'id.', E that, OS se, the, thie, acc. then a, thana, f. thiu, thia, acc. thia, thea, n. that pron. 'id.', Du. die, n. dat pron. 'id.', OHG der, acc. den, f. diu, acc. dea, dia, n. daz pron. 'id.', G der, acc. den, f. die, n. das pron. 'id.' ⇒ \*to- (IE). A pronominal element continuing PIE \*so, f. \*seh₂, n. \*tod, acc. \*tom, \*teh₂m, \*tod. See also \*þar 'there'."
571,8026,\*þagen- w.v. 'to be silent',"\*þagen- w.v. 'to be silent' - Go. þahan w.v. 'id.', ON þegja w.v. 'id.', Far. tiga w.v. 'id.', Elfd. taja w.v. 'id.', OS thagian, thagon w.v. 'id.', OHG dagen w.v. 'id.', MHG dagen w.v. 'id.' ⇒ \*tHk-ehi- (WEUR) - Lat. tacio, -ere 'to be silent' < \*tHk-ehi-. An old stative formation identical to Lat. tacere. In Go. þahan the effects of Verner's law have been removed, but it is unclear on the basis of what form that could have happened; duratives always had zero grade of the root and a stressed -ehi- suffix. Fact is, however, that Gothic has a strong tendency to remove the voicing products ofVerner's law. See also \*þaggon-."
571,8028,\*þaggon- w.v. 'to silence',"\*þaggon- w.v. 'to silence' - ON þagga w.v. 'id.', Nw. tagga w.v. 'id.' ⇒ \*tHk-neh₂- (WEUR). An interesting formation. Formally, the verb looks like the iterative (3sg. \*þakkopi, 3pl. \*þagunanpi < \*tHk-neh₂-ti, \*tHk-nhi-entl) to \*þagen-, but semantically it functions as a causative-factitive ('to put to silence'). As such, it is comparable to nasal presents such as Skt. ri1;ufri 'to make flow', the causative to rfyate 'to flow'. Also compare the inchoative ON þagna, Nw. tagna, Elfd. taungen w.v. 'to become silent' < \*þagnan-, which started out as the media-passive of the same neh₂-present."
571,8030,\*þahsu- m. 'badger',"\*þahsu- m. 'badger' - MDu. das m. 'id.', Du. das c. 'id.', MHG dahs m. 'id.', G Dachs m. 'id.' ⇒ \*ta ks- (WEUR/NIE). Most WGm. forms can straightforwardly be derived from \*dahsa-, but dial. Nw. toks implies ON \*þǭx < \*þahsu-. This u-stem may have split off from a dat.pl. of an n-stem \*þahsan- (cf. \*uhsan- 'ox') that can be postulated on the basis of the late Latin loanword taxo (beside taxus ), the source of Fr. dial. taisson, It. tasso, Sp. tej6n 'badger' (EWAhd: II, 498-501) and possibly also Basque dial. azkoin 'id.' (with loss of initial t, cf. Trask 2008: 122). Outside Germanic, one compares Mir. Tadg, the name of a king whose totem was a badger. The underlying proto-form \*tazgo"
571,8032,\*þaismjan- m. 'sourdough',"\*þaismjan- m. 'sourdough' - OE þæsma m. 'id.', MLG desem m. 'id.', MDu. desem m. 'id.', Du. zuur-desem c. 'id.', OHG deismo m. 'id.', MHG deisme m. 'id.' ⇒ \*teh₂is-mon- (EUR) - Ru. testo, SCr. ti'jesto n. 'dough'; Olr. mis, W toes m. 'id.' < \*teh₂is-to-; CS tiskati, Ru. tiskat', SCr. ti'skati 'to press, squeeze' < \*tih₂s-sk-eh₂-."
571,8034,\*þaka- n. 'roof,"\*þaka- n. 'roof - ON þak n. 'id.', Far. tak n. 'id.', Elfd. tak n. 'id.', OE þæc n. 'id.', Du. dak n. 'id.', OHG dach n. 'id.', G Dach n. 'id.' ⇒ \*tog-o- (IE) - Gr."
572,8040,\*þakjan- w.v. 'to burn',"\*þakjan- w.v. 'to burn' - OE þeccan w.v. 'to burn' ⇒ \*thl1jl-ie- (EUR?). Also cf. OHG dahhazen w.v. 'to blaze, flare' < \*þakatjan-. No further etymology, but possibly related to Gr. TI'Jyavov n. 'frying pan'; since Greek had a suffix -avov for tools, the variant niyr1vov is likely to have come about by metathesis."
572,8042,"\*þakkja- / \*þekka- adj. 'mild(?), sweet(?)'","\*þakkja- / \*þekka- adj. 'mild(?), sweet(?)' - ON þekkr adj. 'pleasant', OHG decki adj. 'dear' ⇒ \*tok-nf- / \*tek-nō- (WEUR) - Olr. etig adj. 'unnatural, un.seemly', W annheg adj. 'unfair, unelegant' < \*IJ·tek-i-. The etymon has been reconstructed as \*þakkja- on the basis of the reconstruction of the OHG adj. as decki\* (EWAhd: II, 555). The adjective is attested only once as the superlative dechisto, and can alternatively also be traced back to \*dee. With ON þekkr, this form could then be derived from PGm. \*þekka-. Both \*þakkja- and \*þekka- can be reconciled with PCel. \*-tek-i- by assuming n-gemination (cf. Luhr 1988: 232)."
572,8044,\*þak(k)on- w.v. 'to touch',"\*þak(k)on- w.v. 'to touch' - OE þaccian w.v. 'to þat, clap, strike gently', MDu. tacken w.v. 'to touch' ⇒ \*th₂g-neh₂- (IE) - Lat. tango, -ere 'to touch' < \*th₂g-neh₂-. An old PIE iterative formation to the strong verb \*takan- - \*tekan-. The dental fricative of OE þaccian is regular: MDu. tacken has its t from the strong verb, where it arose as the result of restored reduplication."
572,8046,\*þambo- f. 'string',"\*þambo- f. 'string' - ON ppmb f. 'guts, womb; bow-string' ⇒ \*tomp-eh₂- (NEVR) - Lith. tempti ( tempiu) 'to stretch' < \*temp-ie-; Lith. timpa f. 'sinew, string' < \*tmp-eh₂-. Cf. Nw. dial. temba f. 'bloatedness' < \*þambjon- and OFri. thempene, thampene f. 'doggedness' < \*þampfn- (with \*þamp- < \*tomp-n-l For the shift of meaning from 'stretch' to 'swell', see \*þinsan-."
572,8048,\*þanga- n. 'seaweed',"\*þanga- n. 'seaweed' - ON pang n. 'id.', MLG dank 'id.' (GM). ON pang is formally reconcilable with OE flung, a word used for several poisonous plants, e.g. aconite, hellebore and LG woden-dung 'hemlock' < \*þunga- (cf. Pokorny JEW: 1068; Magnusson 1989: 1171), but the semantic"
573,8054,\*þanhōn- f. 'clay',"\*þanhōn- f. 'clay' - Go. þahō f. 'clay', OE þōhe, þāhe, þō f. 'id.', OHG diiha f. 'id.', MHG diihe, tiihe f. 'id.', G Ton f. 'id.' ⇒ \*tonk-eh₂- (IE). A formation derived from the PIE root \*tenk- 'to thicken'. Cf. \*þinhla- and \*þinhtu-."
573,8056,\*þanhtu- m. 'thread',"\*þanhtu- m. 'thread' - ON þáttr m. 'strand, thread; section, part; story', Far. t<ittur m. 'strand of a rope; part; song', Elfd. tqt m. 'id.', OHG tiiht m./n. 'wick', G Docht m. 'id.' ⇒ \*tonk-tu- (IE) - Wkh. tan3- / tan3d-, tanz- / tanzd'to fortify the warp (of textiles); to draw a web (of spiders)'. A tu-stem usually reconstructed as \*þehta-. Elfd. tqt m. 'id.', however, proves that the original form must have been \*þanhtu-."
573,8058,"\*þanjan- w.v. 'to stretch, extend'","\*þanjan- w.v. 'to stretch, extend' - Go. uf-þanjan w.v. 'to stretch, extend; to strive for', ON penja w.v. 'to stretch, extend', Far. tenja w.v. 'id.', OE pennan, penian w.v. 'to stretch, spread out, extend, bend (a bow)', OS thenian w.v. 'to stretch', MDu. denen w.v. 'to stretch; to torture', Du. deinen w.v. 'to wave', OHG dennan w.v. 'to stretch, extend', MHG den(n)en s./w.v. 'id.', G dehnen w.v. 'to extend' ⇒ \*ton(h₂)-eie- (IE) - Skt. -tiinayati 'to stretch' < \*ton-eie-; Gr. n-ra(vw 'id.' < \*ti-tn-ie-; Skt. tan6ti 'to stretch, extend', Gr. -ravuμm, ·ravuw 'to stretch, tense, extend, expand' < \*tn-neu-; OAv. us-tiina- adj. 'stretched out' < \*-tnh₂-nō-; Lat. tene6 'to hold, grasp' < \"
573,8060,\*þanka- m. 'thanks',"\*þanka- m. 'thanks' - Go. pagks m. 'id.', ON f:Jpkk f. 'id.', Far. tekk f. 'id.', Elfd. tokk 'id.' ( < \*þanko-), OE pane m. 'thanks, satisfaction', E thanks, OFri. thank m. 'thanks; satisfaction; intention', OS thank m. 'thanks; grace', Du. dank c. 'thanks', OHG dank m. 'thanks; mercy, gratification', G Dank m. 'thanks' ⇒ \*tong-a- (IE). An a-stem related to \*þankjan- (q.v.). Also cf. ON pakka, Far. takka, Elfd. tokka, OE pancian, OFri. thonkia, OS thankon, Du. danken, OHG dankon, G danken 'to thank' < \*þankojan-."
573,8062,\*þankjan- w.v. 'to think',"\*þankjan- w.v. 'to think' - Go. pagkjan w.v. 'to think, plan', ON pekkja w.v. 'to perceive, notice; to comprehend; to know, recognize', OE pencan w.v. 'to think', E to think, OS thenkian w.v. 'to think, consider, watch', Du. denken w.v. 'id.', OHG denkan w.v. 'id.', G denken w.v. 'id.' ⇒ \*tong-eie- (EUR) - Iden-"
574,8068,\*þansjan- w.v. 'to move back',"\*þansjan- w.v. 'to move back' - MLG deisen w.v. 'to sneak away', MDu. dei(n]sen w.v. 'to draw back, stand back', Du. deinzen w.v. 'id.' ⇒ \*tons-eie(IE) - Close to Skt. taTJ1sayati 'to shake', Lith. tqsyti 'to jerk' < \*tons-eie-. MDu. dei{n)sen can have developed out of \*þansjan-, a regular causative (intensive?) to \*þinsan- (q.v.), by diphthongization of e before n plus dental (cf. MDu. ende, einde 'end' < \*andja-), but the corresponding MLG form should then have been \*\*densen (Franck 1949: 110), which is not the case. Perhaps, the original causative \*þansjan- was remodeled into quasi-PGm. \*þaisjan- in the Ingvaeonic area after the regular change of PGm. \*þinsaninto \*þisan-. The "
574,8070,\*þanson- w.v. 'to stretch',"\*þanson- w.v. 'to stretch' - OHG danson w.v. 'to pull, stretch', MHG dansen w.v. 'id.' (DRY). The verb looks like an a-grade iterative to the strong verb \*þinsan- (q.v.), quasi-PIE \*tons-neh₂-. It was borrowed into Romance, cf. It. danzare, Fr. dancer, from where it again spread to the Gm. languages, e.g. E to dance, G tanzen, Du. dansen."
574,8072,\*þar adv. 'there',"\*þar adv. 'there' - Go. þar adv. 'id.', ON þar adv. 'id.', Far. har, poet. tar adv. 'id.', Elfd. dar adv. 'id.', OE þar, pikr adv. 'id.', E there, OFri. ther adv. 'id.', OS thar adv. 'id.', Du. daar adv. 'id.', OHG dar(a) adv. 'id.', MHG dar, da adv. 'id.', G da adv. 'id.' ⇒ \*to-r (DRY). An adverb created to the root \*to- 'that, those' with the locative suffix \*-r. Cf. \*hwar."
574,8074,"\*þarbo- f. 'need, want, lack'","\*þarbo- f. 'need, want, lack' - Go. parba f. 'want, need, necessity', ON pprf f. 'id.', OFri. therve, there f. 'need, want', OS tharf f. 'need, lack' ⇒ \*torp-eh₂- (IE). Also cf. Go. ala-parba adj. 'thoroughly destitute' < \*ala-parban- and the stative Go. ga-parban w.v. 'to abstain', ON parfa 'to be needed', Far. poet. tarva 'to need, want', OE pearjian 'to be in need', OS tharbon 'to Jack', OHG darben 'id.' < \*þarben-."
575,8080,"\*þarha(n)- m. 'seaweed, driftwood'","\*þarha(n)- m. 'seaweed, driftwood' - ON pari m. 'id.', Far. tari m. 'id.', Nw. tar(r}e m. 'seaweed; washed-up wood', MDu. dary, darich m. 'peat sod; muck', Du. derrie c. 'muck' ⇒ \*torl<-on-(?) (NEUR?). Du. derrie has been compared to Go. parihs(?) adj. 'unfulled, unprocessed' by Franck 1949: 1 12, but the connection with ON pari seems more likely in view of Du. (Zaan) derg 'floating island of reed or peat'. No received extra-Germanic etymology. I suspect the word to be related to Lith. tefSti (tersiu, tersiaii) 'to make dirty; to become muddy (of pastures); to spread out hay or grass' < \*terl<-ie-."
575,8082,"\*þarma- m. 'bowel, intestine'","\*þarma- m. 'bowel, intestine' - ON þarmr m. 'id.', OE þearm m. 'id.', OFri. therm m. 'id.', OS tharm m. 'id.', MLG darm m. 'intestine', MDu. dar(e)m m. 'id.', Du. darm c. 'id.', OHG daram, darm m. 'id.', G Darm m. 'id.' ⇒ \*torm-o(EUR) - Gr. i:þāμu; f. 'space between the anus and the genitals, perineum' < \*trm-i-. An o-stem potentially related to the aforementioned Greek word. No further etymology."
575,8084,\*þarzjan- w.v. 'to make dry',"\*þarzjan- w.v. 'to make dry' - ON þerra w.v. 'to dry, make dry; to dry, wipe', MLG derren w.v. 'to dry', MHG derren w.v. 'to wither, dry up' ⇒ \*tors-eie- (IE) - Cf. Skt. tar?ciyati 'to make thirsty' < \*tors-eie-. The causative to \*þersan-. Cf. with the same vowel grade Nw. tarre m .. OHG darra, G Darre f. 'kiln, oast' < \*þarza/ōn-."
575,8086,"\*þaula(n)- m. 'reciter, mumbler(?)'","\*þaula(n)- m. 'reciter, mumbler(?)' - Ice!. þauli m. 'speaker, orator', Nw. dial. tau! m. 'fool, half-wit' (GM). An ablauting form to \*þuli- 'reciter'. Also cf. Nw. dial. tu! and tyl m. 'fool' < \*þula/i-."
575,8088,\*þawa- m. 'custom',"\*þawa- m. 'custom' - OE peaw m. 'custom, usage', ME thew 'habit, practice, virtue', OFri. thaw m. 'custom', OS thau m. 'id.', MLG duw 'conduct', OHG dou m. 'instruction' (GM). The primary meaning of PGm. \*þawa- ( < \*tou(H)o-, \*tof<w-6-?) could have been 'to be observant', which is semantically close to e.g. Lat. tu(e)or 'to look at, watch over, safeguard' < \*tuh₂-ehi-ie- (see \*þeudja-). Within Germanic, it could further be related to OE ge-þeon w.v. 'to do, commit, perform' < \*þewōjan-. Also cf. OE peawlic 'usual', OHG daulih 'decent' < \*þawa-lfka-."
575,8090,"\*þedura- m. 'wood grouse, capercaillie'","\*þedura- m. 'wood grouse, capercaillie' - ON piourr m. 'id.', OSw. picedur m. 'id.', Elfd. tyooer m. 'id.', Da. tjur c. 'id.' ⇒ \*tetr(-uo)- (IE) - Skt tittira- m. 'partridge'; Gr. i:i-rpa4 m. 'black grouse(?)'; Lith. teterva f. 'black grouse'; Ru. teterev m. 'id.'."
576,8096,\*þegjan- s.v. 'to request',"\*þegjan- s.v. 'to request' - ON þiggja s.v. 'to obtain, accept', OE þicgan s.v. 'id.', OS thiggian w.v. 'to ask, request; to endure', OHG dicken, digen w.v. 'to beg for, request', MHG digen w.v. 'id.' ⇒ \*tek-ie- (EUR) - Olr. ad-teich 'to ask', Bret. tizaff 'to receive' < -tek-e-; Lith. tekti (tenku] 'to reach (for); to suffice; to be granted' < \*te-n-k-e-. Both in Germanic and the other IE branches, the original meaning seems to have been 'to reach out the hand' (cf. LIV2: 618-9), whence both 'to request' and 'to accept'. Also cf. \*þegna- 'retainer'."
576,8098,\*þegna- m. 'retainer',"\*þegna- m. 'retainer' - ON þegn m. 'thane, franklin, freeman, man; Hegeman, subject', OE þegn m. 'thane, servant, retainer', OS thegan m. 'youth, man, warrior, disciple', MDu. degen m. 'boy, prince, hero', OHG degan m. 'warrior, valet, companion, hero, soldier', MHG degen m. 'lad, servant, warrior' (DRY). A derivation from the verb \*þegjan- 'to request, beg'. The original meaning was 'retainer', i.e. an aristocratic dependant of a king or nobleman who gives service in return for patronage. The word is traditionally compared to Gr. TEKvov n. 'child', a formation belonging to TLKTW 'to give birth' < \*ti-tk-e(cf. Torp 1909: 177; Pokorny IEW: 1057; Shields 2006). The implied proto-form \*tek-"
576,8100,\*þēka- m. 'drifting seaweed',"\*þēka- m. 'drifting seaweed' - WFri. obs. teek 'id.', NFri. (F) tiak, (Hlg., Mo., Wi., Ka.) teek, (Go., Ha.) tiiik n. 'id.', LG deek, teek, Brem. [eek 'id.', Du. dial., arch. daak, deek, vaak, veek c. 'id.' (GM). An etymologically obscure word (cf. Sjolin 2006: 231) found only dialectally along the North Sea coast (cf. Opprel 1937). The distribution of the coastal deek vs. the more inland daak in the Dutch dialects points to a vowel \*e (rather than \*ai or \*a). In combination with WFri., NFri. teek, which implies an initial fricative, the word can confidently be reconstructed as PGm. \*þēka-. It seems probable, given the geographic distribution, that the word was spread by the Frisians. T"
577,8108,\*þeku- adj. 'fat',"\*þeku- adj. 'fat' - ON þykkr, þjokkr, þjukkr adj. 'id.', Far. tjukkur, tjukkur adj. 'id.', Elfd. tjokk adj. 'id.', OE þicce adj. 'id.', E thick, OFri. thikke adj. 'manifold, multiple', OS thikki adj. 'id.', Du. dik adj. 'fat; thick', OHG dicki adj. 'dense, thick; frequent', G dick adj. 'fat, thick' ⇒ \*tegu- (WEUR) - Olr. tiug adj. 'fat' < \*tegu- (with u-raising and u-infection). An old u-stem that was remodeled into the PNWGm. ja-stem \*þekwja-. The labial element caused breaking of -y- ( < i with w-mutation) to -ju- or -join ON þjukkr, Nw. tjukk, Sw. tjock (for which cf. Nw. tjurr 'dry' < \*þurzu-), and of -i- to -iu- in Frisian, cf. OFri. thiukke f. 'breadth' < \*þekwfn-. Etymologically"
577,8110,"\*þemestra- adj. 'dark, dusky'","\*þemestra- adj. 'dark, dusky' - OE þīestre adj. 'id.', OFri. thiustere adj. 'id.', OS thiustri adj. 'id.' ( < \*þiustrja-), MLG demster adj. 'id.', MDu. dee(m)ster, duuster, vinster adj. 'id.', Du. duister, obs. deemster adj. 'id.', OHG dinstar, finstar adj. 'id.', MHG dinster, dimster, finster adj. 'id.', G finster adj. 'id.' ⇒ \*temhres-rō- (IE) - Skt. tamas- n. 'darkness' < \*temhres- and the derived Skt. tamisra- < \*temh₁-s-ro-; Lith. tamsa f. 'id.' < \*temhrs-eh₂- (whence tamsits adj. 'dark' < \*tomh₁-s-u-); Lat. tenebrae f.pl. 'darkness' < \*temhres-reh₂-; Olr. temel m. 'shadow, darkness', OW timuil, W tywyll 'dark, darkness' < \*temh₁-es-lo-. An old IE word that despite the dialecta"
577,8112,\*þemra- m. 'darkness',\*þemra- m. 'darkness' - OHG demar n. 'dusk' ⇒ \*temh₁-ro- (IE) - Skt. tamra- adj. 'darkening' < \*te/om(h₁}-r6-; Olr. tern adj. 'dark' < \*temh₁-ō-; OCS tbma f. 'darkness' < \*tmh₁-eh₂-.
578,8118,\*þenura- m. 'reaction wood',"\*þenura- m. 'reaction wood' - ON þinurr m. 'resinous fir-tree (of which bows and hoops were made); bow', Nw. tinur, tinar m. 'hard (piece of) wood', Elfd. tiqor m. 'reaction wood' (GM). The Nordic word referred to parts of trees consisting of wood that was particularly strong (socalled 'reaction wood'), e.g. the downward side of an overhanging tree. In view of the additional Old Norse meaning 'bow', this wood was apparently used to make this particular weapon. Formally, there is a complex discrepancy between ON flinurr and Elfd. tiqor, Sw. tjur-, the former continuing \*þinura-, the latter ON \*þjōrr < \*þenura- (with u-breaking, syncope and loss of -nr- as in \*Þōrr 'Thor' (cf. Elfd. tups-"
578,8120,\*þerba- adj. 'tough(?)',"\*þerba- adj. 'tough(?)' - ON þjarfr adj. 'unleavened (of bread); fresh (of water); insipid, flat', OE þeorf adj. 'unleavened', OFri. therve adj. 'rough, fierce', OHG derb adj. 'unleavened', MHG derp adj. 'id.', G dial. derb adj. 'unleavened', Bav. 'dry' ⇒ \*terp-ō- (EUR) - Lith. tii'pti (tirpstu) 'to stiffen' < \*trp-ske-; Lat. torpere 'to be stiff, OCS u-tropeti 'id.' < \*trp-ehi-. An adjective to the root \*terp-. See also \*þurfan- 'to need'."
578,8122,\*þerhwe,"\*þerhwe - \*þurhwe prep., adv. 'through' - Go. flairh prep., adv. 'id.', OE per(i)h, pur(u)h, florh prep., adv. 'id.', E through, OFri. thriuch, thruch prep., adv. 'id.', NFri. troch prep., adv. 'id.', OS thurh, thoro, thuru prep., adv. 'id.', ODu. thuro prep., adv. 'id.', MDu. dare, dure, do(o)rch prep., adv. 'id.', Du. door prep., adv. 'id.', OHG durh, durah, duruh prep., adv. 'id.', G durch prep., adv. 'id.' ⇒ \*terh₂-h₃kw-e (IE) - Hitt. taragzi 'to overcome', Skt. t<irati, -tirati 'to pass, cross over' < \*terh₂-e-, \*trh₂-e-; YAv. titarat 3sg.inj. 'to overcome' < \*ti-trh₂-e-; Hitt. tarna-i 'to let in' < IE \*tr-ne-h₂-; Skt. tiras prep. 'through, across, beyond', Lat. triins prep., adv"
579,8128,\*þerkon- f. 'hole',"\*þerkon- f. 'hole' - Go. þairko f. 'hole' ⇒ \*terh₂-ueh₂- (DRY). An n-stem derived from \*þerhwe - \*þurhwe. The formation is likely to continue Pre-Gm. \*þerkkōn-, which possibly received its geminate in a Pre-Gm. paradigm \*terk-ōn, gen. \*t( e)rk-n-6s (Luhr 1988: 269). Alternatively, the \*k may have arisen from a laryngeal occurring after a liquid and before a \*u, e.g. in a ueh₂-stem \*terh₂-ueh₂- (cf. \*taikwer-)."
579,8130,\*þersan- s.v. 'to be dry',"\*þersan- s.v. 'to be dry' - Go. ga-þairsan s.v. 'to dry up, wither' ⇒ \*ters-e(IE) - Hitt. tarfri\* - tarfanzi 'to become dry', Gr. n:pooμm 'id.' < \*ters-e-. An old strong verb. See also \*þarzjan-, \*þurzu- and \*þurzjan-."
579,8132,\*þeuba- m. 'thief,"\*þeuba- m. 'thief - Go. þiubs m. 'id.', ON pj6fr m. 'id.', OE þeof m. 'id.', E thief, OFri. thiiifm. 'id.', OS thiofm. 'id.', Du. dief c. 'id.', OHG diob, diub m. 'id.', G Dieb m. 'id.' ⇒ \*teup-ō- (GM?) - Lith. tupJti (tupiu) 'to cower' < \*tup-eh₁-ie-. Etymology unclear. The formation OHG diuva, diuba f. 'id.', MHG diuve, diube f. 'id.', G obs. Deufe, Deube f. 'id.' points to a Verner alternation \*þeujjo- \*þeubjō- < \*teup-ieh₂-, and the underlying root \*teup- has by some been compared to Lith. tupJti 'to cower' (cf. \*stelan- 'to sneak; to steal'). Within Germanic, there may be a connection with Ice!. þufla w.v. 'to roam, wander; to stagger; to grope, fumble', Nw. tuvla w.v. 'to loite"
579,8134,\*þeudja- adj. 'favorable',"\*þeudja- adj. 'favorable' - ON pyor adj. 'kind, affectionate, affable', OE ge-þiede adj. 'good, decent' ⇒ \*teuh₂-tiō- (IE?) - Lat. tutus adj. 'safe' < \*tuh₂-tō- (derived from Lat. tueor, tuor 'to look at, watch over, safeguard' < \*tuh₂-ehi-ie-); Gr. ow<;, oao<; adj. 'safe, healthy, intact' (a thematicization of \*oau<; < \*tueh₂-u- Beekes 2010: 1440-1). The word is usually connected to the PIE root \*teuh₂- 'strong', cf. Skt. ut taviti 'to be strong'. The appurtenance of OBret. tut 'good, favorable'(?) is more uncertain in view of the meanings of Olr. tUath adj. 'northern, left; perverse, wicked, evil' and OBret. tuthe 'demon'. Within Germanic, cf. the factitive Go. þiupjan w.v. 'to bles"
580,8140,"\*þeudō- f. 'nation, people'","\*þeudō- f. 'nation, people' - Go. þiuda f. 'id.', ON pj6o f. 'id.', Far. tj6o f. 'id.', OE þeod f. 'id.', OFri. thiiide, thiede f. 'id.', OS thiod, thioda f. 'id.', OHG diota f. 'id.', MHG diet f. 'id.' ⇒ \*teut-eh₂- (EUR) - Osc. touto 'community', Olr. tuath f. 'people, tribe', W tud m. 'people, nation; region, district' < \*te/out-eh₂-; OPru. tauto, Lith. tauta f. 'land', Latv. tauta f. 'people' < \*tout-eh₂-. A European word: the alleged cognates Hitt tuzzi- 'army' (Feist 1924: 130) and Sogd. two'k 'crowd', NP toda 'heap, pile' (Schmid 1968: 10) are uncertain. PGm. \*þeudō- possibly continues an old neuter collective to OHG diot, MHG diet, MDu. diet m. '(free) man' < \*þeuda-. The word w"
580,8142,\*þeuha- n. 'thigh',"\*þeuha- n. 'thigh' - ON pj6 n. 'id.', Far. tj6gv n. 'id.', OE þeoh n. 'id.', E thigh, OFri. thiiich n. 'id.', MDu. die n./f. 'id.', Du. dij c. 'id.', OHG dioh n. 'id.' ⇒ \*teuHk-o- (EUR) - Lith. taukai, Latv. tauki m.pl. 'lard' OPru. taukis 'id.', OCS tuko, Ru. tuk m. 'fat' < \*touHk-o-; Olr. t6n f. 'behind, bottom', MW tin f./m. 'bottom, arse, rear' < \*tuHk-neh₂-. A European word for 'thigh, hip'."
580,8144,\*þeura- m. 'bull',"\*þeura- m. 'bull' - ON pj6rr m. 'id.', Far. tj6rur m. 'castrated bull', OSw. piur m. 'bull', Du. dial. duur m. 'id.' (NIE) - Gr. -raupo<; m. 'bull', Lat. taurus m. 'id.', Lith. tailras m. 'id.', OCS tu/'""'b m. 'id.', Alb. ter 'id.'; Akk. silru, Arab. tawr, Hebr. s6r 'steer' < PSem. \*tawr; Etr. thevru-mines 'Minotaur'. A word with an etymological trajectory leading back to the Middle East rather than the IE homeland on the Pontic-Caspian steppes. I assume that a pre-Indo-European form \*þaur just as in Etruscan thevr- was raised to \*þeur before it was adopted by the speakers of Proto-Germanic, and gave rise to both \*þeura- and \*steura- (q.v.). Note that Limburgian duur, which technically"
580,8146,\*þeutan-,"\*þeutan- - \*þūtan- s.v. 'to howl, roar' - Go. þut-haurn n. 'trumpet', ON pj6ta s.v. 'to howl, whistle, roar', Nw. tjota, tyta s.v. 'id.', OE þeotan, þiitan s.v. 'to howl', OHG diozan s.v. 'to roar', MHG diezen s.v. 'to roar, woosh' (DRY). A strong verb back-formed to the iterative \*tutt/don- (q.v.). No further etymology. The link with Lith. tiitUoti 'to blow' (cf. Fraenkel 1965: 1070) is"
581,8152,\*þewa- m. 'servant',"\*þewa- m. 'servant' - Go. þius m. 'thrall, bondsman, servant', ON -Per þrop. 'id.', OE þeow, þeowa m. 'servant', ME theow 'id.', OS theo-lico adv. 'humble', Du. dee-moedig adj. 'id.', MHG deo m. 'servant' ⇒ \*teu-o- (GM). Also cf. Go. þiwi, ON py, pir, OS thiwi, OE þeowu, -e, OHG diu f. 'female servant' < \*þewf-, gen. -joz < \*teu-i(e)h₂- as well as \*þewen- 'to subdue'."
581,8154,\*þewen- w.v. 'to subdue',"\*þewen- w.v. 'to subdue' - Go. ga-þiwan w.v. 'to subdue, subjugate', ON þjci w.v. 'to constrain; to enslave' (GM). The common opinion on the derivation of the verb is that it was derived from \*þewa- 'servant' (q.v.), and the verb indeed means 'to enslave' in both Gothic and Old English. However, the Old Norse verb pjci has an additional, more primary meaning 'to force' (e.g. hann var Pf cir ti/ vinnu 'he was forced to work'), which implies that the meaning 'to enslave' is secondary. This is further supported by OE ge-þeon 'to tame, oppress' < \*þewojan- and the marginally attested adjective OE þeow adj. 'subservient', OS thio-/iko adv. 'humble', OHG diu adj. 'unfree' < \*þewa- (Heidermanns"
581,8156,\*þīna- pron. 'your',"\*þīna- pron. 'your' - Go. þeins pron. 'id.', ON pinn pron. 'id.', Far. tin pron. 'id.', Elfd. denn pron. 'id.', OE þīn pron. 'id.', OFri. thfn pron. 'id.', OS thfn pron. 'id.', MDu. dijn pron. 'id.', OHG dfn pron. 'id.', G dein pron. 'id.' ⇒ \*t-iHno- (IE). The possessive pronoun pertaining to \*þū 'you' (q.v.). The suffix is likely to be identical to \*-fna- used in e.g. \*aizfna- 'iron' to \*aiza- ( q.v.)."
581,8158,\*þinan- s.v. 'to become moist',"\*þinan- s.v. 'to become moist' - OE þīnan s.v. 'id.' ⇒ \*tei-nh₁-e- (IE) - Hitt zeja(ri} - zejanta(ri) 'to cook, be cooked' < \*tieh₁-o, \*tihi-ōnto; Hitt zanu-zi 'to (make) cook' < \*tihrneu-; Olr. tinaid 'to disappear; to melt' < \*tihi-neh₂-. A nasal present to the root \*teihi-. The original, nasal-less past participle is preserved as ON pilJr adj. 'thawed' < \*þih₁-tō-, whence ON þilJna w.v. 'to"
582,8164,"\*þinga- n. 'meeting, case, thing'","\*þinga- n. 'meeting, case, thing' - ON þing n. 'id.', OE þing n. 'id.', E thing, OFri. thing n. 'id.', OS thing n. 'thing, court, meeting', Du. ding n. 'thing', OHG ding n. 'meeting, court, thing, affair', G Ding n. 'thing' ⇒ \*tenk-ō- (DRV). Related to Got. peihs n. 'time', Lomb. thinx 'legal procedure, assembly' < \*þinhsa-. The original meaning may have been 'scheduled time', whence 'assembly', '(legal) case' and 'object'. As such, the word can be derived from the strong verb \*þinhan- 'to be suitable' (q.v.)."
